,Bios,Movies,TV,Religion,Music,Sports,Books,Politics
4826,Amateur web enthusiast. Organizer. Professional problem solver. Food guru.,0,1,3,7,0,2,7
4827,Proud twitter nerd. Subtly charming social media fanatic. Evil music aficionado. Zombie specialist.,1,5,5,4,4,7,6
4828,Tv scholar. General beer trailblazer. Total zombie aficionado. Internet specialist. Creator.,9,3,9,2,1,4,8
4829,Typical organizer. Devoted writer. Entrepreneur. Beer lover. Hardcore pop culture fanatic. Web trailblazer. Unapologetic thinker.,0,8,0,9,3,2,3
4830,Twitter junkie. Internet lover. Hipster-friendly student. Proud music ninja. Web enthusiast.,8,4,6,2,9,4,6
4831,Gamer. Extreme beer scholar. Evil bacon junkie. Friendly pop cultureaholic. Communicator. Freelance travel maven. Coffee fanatic.,1,2,2,9,0,0,8
4832,Zombie enthusiast. Passionate problem solver. Infuriatingly humble beer guru. Proud bacon specialist. Avid coffee nerd. Music lover.,5,0,5,0,1,6,6
4833,Coffee specialist. Music evangelist. Beer fanatic. Typical gamer. Lifelong travel fan.,8,6,1,1,8,8,9
4834,Wannabe twitter specialist. Tv practitioner. Coffee advocate. Travel trailblazer. Thinker. Music scholar. Communicator.,9,0,1,0,6,4,1
4835,Proud web geek. Passionate internet maven. Unapologetic explorer. Devoted problem solver.,2,1,2,8,3,4,7
4836,Hipster-friendly troublemaker. Web specialist. Total pop culture scholar. Extreme beeraholic.,3,8,4,7,5,5,3
4837,Writer. Lifelong entrepreneur. Analyst. Evil bacon fan. Hipster-friendly music geek. Thinker. Beer junkie.,0,1,4,4,1,1,6
4838,Pop culture ninja. Hardcore problem solver. Thinker. Zombie scholar. Music advocate. Web fan.,9,0,3,2,6,7,3
4839,Twitter guru. Proud internet fan. Friendly coffee buff. Unapologetic alcohol scholar. Freelance writer. Organizer.,7,7,3,9,9,5,2
4840,Problem solver. Lifelong travel lover. Food buff. Friend of animals everywhere.,6,2,2,8,2,5,8
4841,Subtly charming zombie junkie. Professional tv scholar. General gamer. Total alcohol aficionado. Wannabe music fanatic.,8,4,6,4,2,0,3
4842,Lifelong tv fanatic. Infuriatingly humble internet aficionado. Analyst. Devoted introvert.,8,4,5,7,0,5,8
4843,Food specialist. Zombie ninja. Music practitioner. Infuriatingly humble pop culture aficionado.,5,7,7,9,2,8,2
4844,Avid organizer. Hipster-friendly food expert. Total tv practitioner. Friend of animals everywhere. Lifelong reader.,2,0,8,3,0,7,5
4845,Professional food enthusiast. Travel fanatic. Devoted alcohol advocate. Extreme social media fan. Introvert.,2,1,3,8,0,8,8
4846,Friendly introvert. Lifelong communicator. Award-winning food enthusiast. Amateur pop culture advocate. Tv nerd.,2,2,6,5,8,9,1
4847,Web scholar. Beer specialist. Subtly charming twitter geek. Avid coffee junkie. Internet ninja.,5,7,7,5,6,4,0
4848,Entrepreneur. Professional student. Falls down a lot. Writer. Hardcore organizer. Devoted travel fanatic. Zombie trailblazer.,1,4,8,5,3,0,5
4849,Bacon junkie. Coffee nerd. Alcohol evangelist. Food aficionado. Internet scholar. Tv trailblazer. Troublemaker. Gamer.,8,8,2,5,3,0,3
4850,Bacon advocate. Subtly charming travel geek. Passionate social media scholar. Beer maven.,4,2,8,4,6,2,4
4851,Infuriatingly humble internet ninja. Music nerd. Explorer. Wannabe introvert. Award-winning reader.,9,2,1,5,0,0,7
4852,Proud organizer. Food nerd. Extreme thinker. Evil alcohol expert. Falls down a lot. Freelance music buff. Explorer.,3,7,5,7,2,8,4
4853,Lifelong analyst. Travel advocate. Incurable music nerd. Creator. Professional thinker. Writer. Tv lover. Reader. Web geek. Twitter evangelist. Student.,3,5,5,5,3,9,5
4854,Avid web evangelist. Hardcore communicator. Beer trailblazer. Certified zombie fan.,4,7,2,0,7,3,1
4855,Friendly music guru. Twitter trailblazer. Tv advocate. Typical zombie fan. Organizer. Entrepreneur.,2,1,6,4,5,4,3
4856,Total social media evangelist. Avid introvert. Lifelong bacon expert. Zombie lover.,0,7,9,9,0,6,8
4857,Food fanatic. Devoted alcohol trailblazer. Award-winning music expert.,8,3,2,2,0,6,2
4858,Gamer. Writer. Web maven. Wannabe coffee fanatic. Avid beer advocate. Communicator.,9,8,3,7,3,9,8
4859,Food guru. Web practitioner. General writer. Passionate zombie enthusiast. Freelance tv specialist.,7,8,0,3,4,3,4
4860,Certified troublemaker. Professional communicator. Award-winning tv fanatic.,2,3,9,9,2,7,7
4861,Incurable alcohol practitioner. Avid social media expert. Internet fanatic. Amateur zombie evangelist. General bacon scholar. Freelance gamer. Travel buff.,4,7,1,3,7,9,9
4862,Wannabe thinker. General travel geek. Introvert. Zombie lover. Friend of animals everywhere. Extreme twitter evangelist. Music fanatic.,8,7,5,2,7,8,0
4863,Troublemaker. Thinker. Reader. Writer. Passionate coffee advocate. Pop culture trailblazer.,5,2,2,2,6,5,8
4864,Music buff. Travel scholar. Zombie fanatic. Coffee specialist. Explorer. Thinker. Social media nerd. Pop culture ninja.,0,6,4,4,2,7,0
4865,Award-winning zombie ninja. Subtly charming web evangelist. Total social media guru. Internet enthusiast.,4,1,7,5,1,6,3
4866,Beer scholar. Student. Tv advocate. Music evangelist. Typical coffee fanatic. Total webaholic.,5,9,0,1,2,5,4
4867,Friend of animals everywhere. Student. Amateur social media junkie. Reader. Alcohol aficionado.,5,0,6,1,7,3,2
4868,Total social media trailblazer. Proud music advocate. Hipster-friendly zombie maven.,8,3,8,0,3,7,0
4869,Entrepreneur. Beer practitioner. Total student. Future teen idol. Coffee scholar. Pop cultureaholic.,2,4,3,1,3,3,5
4870,Web trailblazer. Devoted gamer. Alcohol evangelist. Reader. Social media buff. Subtly charming coffee lover. Twitter aficionado.,6,5,1,0,9,6,4
4871,Hardcore internet fanatic. Coffee guru. Beer nerd. Gamer. Web expert. Organizer. Typical student.,4,6,9,0,7,5,3
4872,Social media specialist. Pop culture practitioner. Alcohol expert. Web fanatic. Lifelong twitter fan. Evil travel geek.,7,7,4,2,7,1,7
4873,Extreme beer geek. Evil food expert. Tv scholar. Award-winning web junkie.,3,4,3,9,3,7,2
4874,Friendly bacon advocate. Lifelong music fanatic. Hardcore alcohol nerd. Devoted twitter specialist. Professional beer junkie. Writer.,1,4,4,7,8,7,1
4875,Proud thinker. Beer fanatic. Internet enthusiast. Webaholic. Twitter expert. Zombie fan. Entrepreneur.,5,3,6,7,4,1,6
4876,Avid music ninja. Wannabe tv expert. General web fan. Beer practitioner. Lifelong zombie nerd.,3,5,2,0,1,7,4
4877,Beer nerd. Social media lover. Alcohol buff. Award-winning coffee advocate. Zombie junkie. Travel fan. Bacon ninja.,0,8,4,0,7,1,5
4878,Avid troublemaker. Professional internet specialist. Tv trailblazer. Beer lover. Twitter geek. Hipster-friendly introvert.,6,7,2,6,1,5,6
4879,Subtly charming alcohol expert. Beer maven. Tv practitioner. Wannabe pop culture enthusiast.,6,5,9,4,4,1,2
4880,Tv aficionado. Subtly charming beer practitioner. Food advocate. Bacon evangelist. Total internetaholic. Friendly social media fan.,9,8,5,0,5,4,3
4881,Explorer. Web lover. Typical social mediaholic. Hardcore food ninja. Creator. Unapologetic student. Zombie enthusiast. Evil twitter buff.,2,7,2,9,6,5,5
4882,Avid coffee geek. Internet evangelist. Troublemaker. Infuriatingly humble social media advocate.,6,3,1,2,7,1,4
4883,Alcohol geek. Passionate coffee aficionado. Communicator. Devoted web nerd. Amateur creator. Falls down a lot. Tv guru.,6,6,7,7,9,5,0
4884,Bacon buff. Beer trailblazer. Travel scholar. Reader. Typical zombie lover. Proud music fanatic.,9,5,4,0,4,6,4
4885,Alcohol junkie. Extreme social media fanatic. Freelance internet maven. Web scholar. Wannabe organizer. Typical food ninja. Beer geek. Subtly charming writer.,1,3,1,9,7,4,3
4886,Internet nerd. Subtly charming analyst. Proud travel practitioner. Award-winning music fan.,3,0,4,1,2,7,2
4887,Music lover. Typical travel fan. Unapologetic coffeeaholic. Devoted tv geek. Introvert.,5,5,1,0,0,5,0
4888,Professional alcohol expert. Devoted food buff. Social media specialist.,2,5,0,8,4,0,8
4889,Typical web expert. Tv practitioner. Award-winning social media ninja. Alcohol maven.,4,8,6,4,4,9,6
4890,Friendly tv maven. Troublemaker. Professional coffee specialist. Award-winning travel ninja. Music fanatic. Freelance explorer. Amateur problem solver.,5,8,7,2,3,5,4
4891,Subtly charming problem solver. Organizer. Troublemaker. Unapologetic bacon fanatic. Freelance coffee guru. Friendly introvert. Thinker.,5,1,7,2,7,0,3
4892,Food enthusiast. Incurable social media trailblazer. Certified troublemaker.,2,1,1,2,8,9,0
4893,Analyst. Evil music enthusiast. Friend of animals everywhere. Student. Zombie advocate. Bacon junkie. Tvaholic.,2,9,7,5,8,5,4
4894,Pop culture maven. Incurable zombie lover. Social media advocate. Typical foodaholic. Coffee aficionado. Alcohol fan. Bacon nerd.,8,9,9,0,0,1,1
4895,Web specialist. Alcohol fanatic. Unapologetic student. Subtly charming coffee evangelist.,4,0,3,0,8,5,1
4896,Explorer. Evil thinker. Hardcore communicator. Music trailblazer. Food fan. Unapologetic student. Beer practitioner.,9,5,6,7,6,9,8
4897,Award-winning travel fanatic. Troublemaker. Organizer. Evil writer. Pop culture enthusiast.,9,1,2,5,8,6,7
4898,Organizer. Social media practitioner. Hipster-friendly travel buff. Devoted internet guru.,9,6,6,9,3,6,0
4899,Passionate zombie fan. General web evangelist. Troublemaker. Avid internet expert.,2,3,1,3,0,0,1
4900,Twitter geek. Amateur pop culture nerd. Social media aficionado. Troublemaker. Creator.,9,7,0,5,3,6,8
4901,Social media guru. Total music fanatic. Pop culture ninja. Amateur organizer. Food advocate. Creator. Entrepreneur.,8,3,7,0,1,6,1
4902,Music guru. Certified social media fanatic. Future teen idol. General zombie specialist. Proud communicator.,9,9,2,2,6,1,9
4903,Twitter lover. Student. Passionate social media evangelist. Total web fanatic. Beer specialist. Music ninja.,3,8,5,2,1,3,7
4904,Bacon lover. Travel enthusiast. Incurable music fanatic. Friendly introvert.,6,8,4,6,6,9,1
4905,Zombie advocate. Coffee expert. Proud reader. Freelance creator. Extreme bacon guru.,3,7,9,0,4,3,3
4906,Organizer. Freelance beer evangelist. Hardcore twitter buff. Coffee lover. Amateur alcohol fan.,5,8,4,0,5,6,6
4907,Hipster-friendly social media fanatic. Food evangelist. Devoted alcoholaholic. Explorer. Pop culture buff.,7,8,5,3,9,2,4
4908,Infuriatingly humble communicator. Devoted food advocate. Gamer. Twitter guru. Explorer.,0,4,4,8,5,2,9
4909,Social media fan. Music trailblazer. Coffee enthusiast. Typical zombie geek. Introvert. Passionate twitter evangelist.,3,9,5,7,5,8,6
4910,Extreme internet lover. Webaholic. Writer. Social media practitioner. Wannabe introvert. Zombie evangelist.,4,6,3,9,0,6,7
4911,Hipster-friendly tvaholic. Extreme problem solver. Passionate food trailblazer. Avid zombie expert.,5,2,5,7,1,9,6
4912,Proud tv practitioner. General internet advocate. Gamer. Twitter fanatic. Coffee geek. Introvert.,1,3,9,2,5,1,9
4913,Freelance alcohol ninja. Twitter practitioner. Pop culture geek. Web evangelist. Hipster-friendly troublemaker.,4,5,7,1,1,5,3
4914,Entrepreneur. Reader. Avid food ninja. Falls down a lot. Typical tv maven.,3,2,7,6,5,2,5
4915,Reader. Organizer. Unapologetic entrepreneur. Coffee geek. Twitter guru.,8,7,0,8,3,7,1
4916,Zombie buff. Subtly charming web fanatic. Incurable food expert. Twitter junkie. Troublemaker.,4,3,5,9,6,9,1
4917,Coffee nerd. Twitter advocate. Pop culture fanatic. Alcohol practitioner. Prone to fits of apathy.,4,3,0,9,5,2,2
4918,Total analyst. Pop culture guru. Internet scholar. Creator. Twitteraholic. Freelance bacon practitioner. Travel expert.,9,0,1,9,9,1,7
4919,Future teen idol. Pop culture lover. Certified beer guru. Hipster-friendly twitter junkie. Social media enthusiast.,0,1,7,7,3,8,8
4920,Organizer. Explorer. Amateur twitter specialist. Unapologetic zombie trailblazer. Subtly charming alcohol buff. Bacon maven. Certified social media lover.,2,6,1,9,9,3,9
4921,Total organizer. Friendly internet lover. Unable to type with boxing gloves on. Music buff.,7,8,9,3,3,0,6
4922,Communicator. Music nerd. Food fanatic. Amateur creator. Freelance writer. Hardcore beer geek. Gamer. Tv advocate.,6,2,8,4,4,0,4
4923,Infuriatingly humble student. Certified travel fanatic. Bacon trailblazer. Coffee guru. Alcohol ninja. Gamer.,8,3,7,8,6,8,4
4924,Reader. Infuriatingly humble social media guru. Professional gamer. Foodaholic. Problem solver.,1,7,7,0,3,0,2
4925,Typical writer. Thinker. Avid explorer. Problem solver. Hipster-friendly food buff. Unapologetic internet junkie. Professional travel fan.,5,0,3,5,8,5,1
4926,Extreme problem solver. Award-winning alcohol junkie. Hardcore food fanatic. Professional social mediaholic. Writer.,5,4,3,4,1,4,5
4927,Music trailblazer. Bacon lover. Wannabe beer fanatic. Proud introvert. Twitter buff.,9,5,9,3,0,4,6
4928,Student. Wannabe travel maven. Beer fan. Reader. Evil explorer. Avid tv fanatic. Unapologetic music scholar. Lifelong coffee geek.,4,1,7,2,4,9,8
4929,Social media trailblazer. Extreme coffee evangelist. Gamer. Unapologetic beer aficionado.,7,4,1,3,2,0,9
4930,Social media maven. Writer. Evil creator. Bacon nerd. Zombie trailblazer. Hipster-friendly twitter fan.,2,9,5,5,1,7,1
4931,Coffee junkie. Social media ninja. Typical twitter specialist. Tvaholic. Student.,6,8,1,5,5,0,1
4932,Analyst. Student. Proud coffee nerd. Internet guru. Web enthusiast. General explorer. Passionate troublemaker.,6,5,2,4,1,0,9
4933,Falls down a lot. Extreme social media nerd. Unable to type with boxing gloves on. Incurable pop culture evangelist.,5,9,6,0,4,1,9
4934,Tv trailblazer. Problem solver. Social media scholar. General web junkie. Twitter evangelist.,7,1,6,4,2,0,0
4935,Internet practitioner. Certified tv enthusiast. Beer specialist. Hardcore pop culture aficionado. Web scholar.,3,5,8,3,0,4,2
4936,Alcohol fan. Beeraholic. Future teen idol. Extreme introvert. Troublemaker. Incurable food guru. Wannabe gamer.,8,6,4,3,1,1,3
4937,Alcohol fan. Music scholar. Extreme tv expert. Infuriatingly humble social media specialist. Internet evangelist. Coffeeaholic.,6,4,4,3,7,2,9
4938,Evil zombie trailblazer. Alcohol practitioner. General coffee fan. Subtly charming student.,2,3,5,0,1,7,5
4939,Tv junkie. Total reader. Troublemaker. Thinker. Food buff. Infuriatingly humble beer guru. Web fan.,5,9,5,0,0,6,1
4940,Reader. Avid social media buff. Unapologetic troublemaker. Wannabe creator. Internet evangelist. Writer.,2,4,1,7,2,3,2
4941,Hardcore creator. Total web lover. Freelance music trailblazer. Social media geek.,8,5,6,7,2,3,9
4942,Twitter fan. General web evangelist. Evil food maven. Infuriatingly humble communicator. Travel geek. Organizer. Explorer. Coffee fanatic.,5,0,7,3,4,5,0
4943,Subtly charming communicator. Incurable bacon geek. Wannabe pop culture guru. Devoted writer. Twitter lover.,9,6,0,7,4,8,7
4944,Unapologetic reader. Social media lover. Wannabe writer. Food ninja. Freelance introvert. Future teen idol.,8,5,3,2,7,9,8
4945,Hipster-friendly travel maven. Reader. General alcohol aficionado. Certified beer junkie. Web geek.,5,9,4,5,7,0,2
4946,Wannabe beer fanatic. Award-winning analyst. Pop culture trailblazer. Problem solver. Web buff. Hipster-friendly social media evangelist.,2,2,7,6,8,1,8
4947,Zombie fanatic. Bacon geek. Web ninja. Hipster-friendly twitteraholic. Internet fanatic. Pop culture aficionado. Gamer.,1,0,5,0,9,3,2
4948,Web trailblazer. Lifelong music buff. Incurable twitter fanatic. Certified food aficionado.,2,1,4,2,8,5,3
4949,Incurable twitter enthusiast. Travel evangelist. Hardcore web trailblazer. Entrepreneur. Thinker. Zombie specialist. Writer.,9,9,6,7,9,1,4
4950,General explorer. Pop culture practitioner. Reader. Problem solver. Entrepreneur. Zombieaholic. Passionate music trailblazer. Alcohol guru.,9,4,9,8,1,1,0
4951,General internet scholar. Award-winning introvert. Certified zombie enthusiast.,4,5,7,5,4,1,1
4952,Total writer. Award-winning introvert. Web junkie. Unapologetic analyst.,5,7,2,0,6,6,0
4953,Social media advocate. Music expert. Bacon fanatic. Extreme internet ninja. Food nerd. Subtly charming beer buff. Prone to fits of apathy.,2,8,8,0,4,3,4
4954,Bacon maven. Infuriatingly humble alcohol scholar. Passionate pop culture buff.,7,0,9,0,4,4,2
4955,Freelance explorer. Typical beer guru. Proud alcohol junkie. Friendly bacon fanatic.,0,9,4,6,5,7,2
4956,Music fanatic. General twitter evangelist. Passionate foodaholic. Wannabe beer advocate. Organizer.,0,1,8,3,5,0,0
4957,Subtly charming alcohol guru. Social media fanatic. Hardcore problem solver.,2,6,7,5,5,6,9
4958,Total beer expert. Freelance pop culture fan. Social media buff. Professional zombie specialist. Travel fanatic. Introvert.,1,0,0,4,7,9,5
4959,Award-winning internet lover. Friendly reader. Hardcore explorer. Communicator. Tv advocate. Professional writer.,1,0,2,0,8,6,0
4960,Extreme zombie aficionado. Pop culture expert. Beer fanatic. Award-winning troublemaker.,1,4,8,9,2,4,9
4961,Unapologetic tv aficionado. Analyst. Twitter nerd. Hipster-friendly explorer. Extreme organizer. Pop culture ninja.,2,8,2,6,1,9,1
4962,Hardcore bacon fanatic. Future teen idol. Amateur problem solver. Friendly tv maven. Unable to type with boxing gloves on.,6,9,8,6,7,9,0
4963,Evil food expert. Friendly bacon evangelist. General writer. Introvert. Professional coffee guru. Wannabe tv junkie.,3,1,6,3,0,6,1
4964,Pop culture evangelist. Troublemaker. Total explorer. Extreme twitter lover. Food fan. Alcohol specialist.,1,1,8,6,3,9,4
4965,Hipster-friendly writer. Devoted musicaholic. Subtly charming travel maven. Prone to fits of apathy.,2,5,3,3,5,7,4
4966,Writer. Freelance tv expert. Unapologetic travel lover. Devoted troublemaker. Twitter buff. Proud organizer.,9,2,9,0,2,7,7
4967,Devoted internet evangelist. Food ninja. Future teen idol. Passionate beer nerd. Web junkie. Amateur bacon aficionado. Music fanatic.,6,6,8,5,3,3,0
4968,Web junkie. Coffee geek. Explorer. Hardcore social media enthusiast. Professional introvert.,7,4,1,4,2,3,6
4969,Amateur coffee ninja. Total communicator. Friendly pop culture practitioner. Problem solver. Beer geek.,1,4,4,2,5,0,8
4970,Zombie fan. Subtly charming twitter ninja. Hipster-friendly internet geek.,1,1,6,5,5,5,2
4971,Subtly charming social media maven. Hipster-friendly coffee enthusiast. Wannabe pop culture evangelist. Food scholar.,7,9,2,2,3,2,9
4972,Total food fan. Travel junkie. Subtly charming internet guru. Zombie specialist. Friendly analyst. Web fanatic.,8,8,8,4,3,3,3
4973,Problem solver. General travel nerd. Typical pop culture buff. Amateur creator.,3,0,0,1,8,1,2
4974,Unapologetic analyst. Amateur social media guru. Internet geek. Organizer. Freelance student.,9,5,9,7,7,4,4
4975,Coffee lover. Amateur organizer. Hardcore tv aficionado. Bacon maven. Twitter practitioner.,7,8,2,3,1,8,3
4976,Baconaholic. Pop culture fanatic. Problem solver. Amateur beer practitioner. Analyst.,9,0,9,8,5,4,4
4977,General travel expert. Infuriatingly humble pop culture practitioner. Devoted analyst.,6,4,0,4,7,6,2
4978,Unapologetic bacon specialist. Typical music lover. Alcohol fanatic. Avid problem solver. Devoted thinker. Reader.,2,1,3,7,6,2,1
4979,Zombie scholar. Music expert. Beer trailblazer. Organizer. Travel lover. Lifelong pop culture practitioner. Creator. Devoted food junkie.,6,2,8,8,0,0,3
4980,Bacon enthusiast. Hardcore web lover. Lifelong coffee geek. Prone to fits of apathy. Proud internet junkie. Tv fan.,4,3,3,8,2,0,8
4981,Hardcore student. Web specialist. Avid zombie maven. Twitter practitioner. Alcohol expert.,0,0,4,3,0,7,3
4982,Infuriatingly humble coffee expert. Wannabe pop culture nerd. Reader. Zombie geek. Gamer.,6,2,7,9,8,6,7
4983,Analyst. Twitter practitioner. Professional organizer. General tvaholic. Problem solver. Introvert. Music advocate.,2,3,2,1,9,1,6
4984,Twitter fanatic. Internet aficionado. Prone to fits of apathy. Unapologetic bacon nerd.,2,8,6,1,3,4,8
4985,Passionate twitter advocate. Food specialist. Bacon trailblazer. Alcohol ninja. Travel scholar.,0,5,0,7,8,4,5
4986,Food maven. Bacon geek. General writer. Professional tvaholic. Avid communicator.,0,6,9,1,7,3,5
4987,Subtly charming music trailblazer. Entrepreneur. Total zombie ninja. Amateur creator. Pop cultureaholic. Bacon scholar. Coffee fan.,9,2,0,9,1,3,6
4988,Zombie fanatic. Analyst. Unapologetic social media fan. Award-winning explorer. Internet nerd.,8,5,8,1,1,1,7
4989,Incurable explorer. Web trailblazer. Amateur zombie scholar. General problem solver.,9,9,8,4,9,3,8
4990,Hipster-friendly gamer. Writer. Passionate pop cultureaholic. Bacon specialist.,6,8,6,3,2,6,5
4991,Award-winning troublemaker. Coffee trailblazer. Extreme social media buff. Food advocate.,6,8,7,7,0,3,4
4992,Coffee practitioner. Bacon fanatic. Entrepreneur. General food specialist. Internet maven.,1,2,2,0,8,5,6
4993,Avid problem solver. Creator. Alcohol nerd. Reader. Communicator. Thinker. Pop culture expert. Passionate analyst. Web advocate. Proud tv fanatic.,1,2,0,5,4,3,1
4994,Infuriatingly humble alcohol lover. Bacon expert. Web practitioner. Food trailblazer. Amateur pop culture evangelist.,7,8,1,3,3,8,6
4995,Wannabe twitter buff. Web fanatic. Total pop culture junkie. Prone to fits of apathy. Beer guru.,1,2,1,7,1,7,0
4996,Unapologetic alcohol guru. Bacon practitioner. Food specialist. Devoted social media buff. Typical tvaholic.,1,2,1,9,1,5,8
4997,Hardcore tv fanatic. Beer lover. Amateur communicator. Internet buff. Lifelong creator.,5,6,3,4,8,8,6
4998,Subtly charming social media geek. Typical food guru. Hardcore coffee advocate. General explorer.,7,5,7,8,9,1,4
4999,Prone to fits of apathy. Avid entrepreneur. Subtly charming pop culture aficionado. Extreme beer practitioner. Infuriatingly humble reader.,4,4,8,5,0,0,1
5000,Beer evangelist. Hipster-friendly introvert. Coffee fanatic. Twitter lover. Internet scholar. Web specialist. Troublemaker.,0,2,2,8,9,1,3
5001,Pop culture specialist. Proud music ninja. Travel fanatic. Coffee fanatic. Twitter expert.,9,6,9,7,5,8,4
5002,Analyst. Prone to fits of apathy. Lifelong pop culture guru. Creator. Wannabe coffee trailblazer.,4,2,8,3,9,3,4
5003,Subtly charming alcohol ninja. Twitter scholar. Professional internet aficionado.,7,3,7,8,6,3,6
5004,Proud alcohol geek. Internet buff. Tv junkie. Web aficionado. Introvert. Incurable reader.,1,1,9,8,8,9,8
5005,Freelance bacon fanatic. Tv guru. Proud alcoholaholic. Student. Troublemaker. Food lover. Wannabe reader. Pop culture practitioner. Professional entrepreneur.,7,8,1,3,0,9,4
5006,General zombie trailblazer. Award-winning pop culture aficionado. Tv scholar. Internet geek. Prone to fits of apathy. Thinker.,1,5,2,0,9,4,0
5007,Writer. Typical webaholic. Social media trailblazer. Extreme analyst. Friendly tv nerd. Student.,9,2,4,4,6,4,8
5008,General food expert. Gamer. Travelaholic. Award-winning web scholar. Introvert. Beer maven. Certified communicator. Zombie nerd.,4,2,8,0,5,5,0
5009,Twitter lover. Unapologetic web specialist. Certified analyst. Zombie buff. Pop culture scholar.,8,6,8,4,5,4,4
5010,Incurable internet lover. Pop culture guru. Certified beeraholic. Web junkie. Travel specialist.,4,9,1,9,4,8,0
5011,Typical pop culture trailblazer. Award-winning social media lover. Incurable reader. Unapologetic tv scholar.,3,9,6,0,1,2,7
5012,Hardcore beer practitioner. Typical bacon evangelist. Certified social media buff.,7,9,6,0,6,8,9
5013,Certified entrepreneur. Wannabe social media fanatic. Prone to fits of apathy.,0,0,6,0,3,1,8
5014,Unable to type with boxing gloves on. Falls down a lot. Communicator. Beer buff. Internet practitioner. Hipster-friendly webaholic. Food expert. Reader.,5,9,6,2,5,8,4
5015,General web enthusiast. Twitter fan. Tv trailblazer. Hipster-friendly explorer. Extreme creator.,0,4,7,3,0,2,3
5016,Tv nerd. Hipster-friendly coffee evangelist. Typical introvert. Total thinker.,2,4,3,8,9,8,6
5017,Subtly charming food fanatic. Lifelong entrepreneur. Thinker. Music practitioner. Writer.,4,6,0,0,4,8,5
5018,Friend of animals everywhere. Hardcore internet advocate. Subtly charming twitter aficionado.,2,4,7,2,7,8,0
5019,Wannabe pop culture ninja. Food expert. Award-winning music practitioner. Extreme problem solver. Tv lover.,3,4,5,8,5,6,3
5020,Future teen idol. Beer maven. Troublemaker. Lifelong tv fanatic. Evil zombie expert. Hardcore coffeeaholic. Pop culture lover.,6,2,9,0,3,2,0
5021,Total music maven. Food geek. Pop culture advocate. Evil zombie ninja. General beer fan.,3,1,0,0,2,4,7
5022,Lifelong travel advocate. Certified food buff. Gamer. Incurable internet fanatic.,3,9,5,9,9,2,2
5023,Evil tv specialist. Zombie aficionado. Pop culture advocate. Internet fanatic. Music guru. Twitter enthusiast.,6,7,1,2,5,5,4
5024,Explorer. Subtly charming social media maven. Professional coffee nerd. Friendly problem solver.,3,3,2,8,9,7,7
5025,Proud internet geek. Music trailblazer. Incurable tv guru. Freelance social media practitioner.,7,0,0,3,8,9,3
5026,Bacon nerd. Hardcore food advocate. Creator. Professional gamer. Web maven. Internet guru. Explorer. Amateur music scholar.,7,5,6,8,7,2,1
5027,Certified coffee enthusiast. Avid travel aficionado. Devoted twitter fanatic. Future teen idol.,3,3,6,7,2,9,0
5028,Certified tv junkie. Problem solver. Pop culture expert. General web geek. Infuriatingly humble organizer. Introvert. Professional coffee aficionado.,2,5,4,8,3,3,6
5029,Bacon scholar. Pop culture enthusiast. Award-winning tv fan. Total travel specialist. Troublemaker.,2,7,7,3,2,9,3
5030,Foodaholic. Incurable web expert. Total music advocate. Reader. Prone to fits of apathy.,9,1,7,6,1,8,7
5031,Pop cultureaholic. Communicator. Certified troublemaker. Problem solver. Thinker. Creator.,3,9,1,0,9,2,0
5032,Professional music trailblazer. Reader. Passionate tv lover. Friend of animals everywhere.,9,3,6,0,7,3,8
5033,Infuriatingly humble gamer. Analyst. Music scholar. Tv fan. Travel ninja. Unapologetic internet enthusiast. Evil problem solver. Reader. Devoted food fanatic.,2,6,5,0,8,1,0
5034,Student. Hardcore gamer. Beer guru. Total creator. Incurable coffee scholar.,8,9,3,9,3,6,0
