,Bios,Movies,TV,Religion,Music,Sports,Books,Politics
1691,Communicator. Total explorer. Unapologetic pop culture trailblazer. Proud coffee scholar.,4,8,3,4,6,5,9
1692,Music fanatic. Proud web buff. Twitter ninja. Explorer. Social mediaholic. Pop culture expert. Food advocate.,1,1,9,0,2,4,7
1693,Devoted entrepreneur. Friendly writer. Zombie junkie. Bacon specialist. Hipster-friendly social media nerd.,6,7,1,8,4,6,5
1694,Proud tv lover. Thinker. Communicator. Internet fanatic. Future teen idol. Lifelong beer guru.,4,5,6,7,9,3,8
1695,Unapologetic beer geek. Passionate pop culture junkie. Analyst. Incurable zombie evangelist.,1,7,6,4,6,3,2
1696,Avid alcohol guru. Wannabe pop culture nerd. Unapologetic zombie practitioner. Gamer. Social media specialist.,1,1,7,9,3,2,8
1697,Travel fan. Music advocate. Freelance bacon lover. Hardcore internet enthusiast.,1,3,0,8,0,4,9
1698,Hipster-friendly zombie guru. Analyst. Alcohol nerd. Bacon fanatic. Typical internet ninja.,7,3,9,6,4,1,5
1699,Travel fan. Entrepreneur. Professional twitter junkie. Thinker. Music evangelist.,2,8,5,9,9,1,9
1700,Typical music specialist. Hardcore beer fanatic. General troublemaker. Friendly alcohol maven.,1,3,4,0,4,3,2
1701,Amateur music maven. Creator. Freelance internet scholar. Beer aficionado.,9,9,9,0,5,8,9
1702,Analyst. Amateur student. Unapologetic twitter aficionado. Evil writer. Tv geek. Hardcore pop culture trailblazer. Devoted organizer.,6,6,0,1,7,2,3
1703,Introvert. Typical travel aficionado. Hardcore internet fan. Incurable creator. Tv ninja. Lifelong zombie maven. Extreme pop culture enthusiast.,1,6,0,0,9,3,4
1704,Web advocate. Extreme analyst. Lifelong entrepreneur. Food guru. Freelance beer expert.,5,6,4,7,0,1,5
1705,Introvert. Lifelong travel ninja. Gamer. Award-winning creator. Extreme troublemaker. Bacon lover. Beer nerd.,7,0,4,2,4,4,3
1706,Internet trailblazer. Web junkie. Prone to fits of apathy. Travel fanatic. Creator.,8,8,1,8,8,3,6
1707,Music evangelist. Communicator. Tv fan. Proud writer. Subtly charming entrepreneur. Certified web ninja. Twitter nerd. Lifelong organizer.,4,7,4,3,8,8,6
1708,Devoted travel specialist. Thinker. Social media practitioner. Bacon ninja. Friendly food junkie. Hipster-friendly pop culture fan.,2,3,8,0,2,2,3
1709,Internetaholic. Writer. Web aficionado. Devoted twitter scholar. Zombie practitioner. Food guru.,7,3,6,8,4,7,8
1710,Friendly coffeeaholic. Bacon lover. Pop culture fanatic. Food trailblazer. Zombie junkie.,6,4,0,0,2,4,5
1711,Proud web evangelist. Travel ninja. Creator. Freelance food nerd. Passionate bacon fanatic.,6,3,3,7,3,5,1
1712,Award-winning coffee guru. Certified bacon geek. Web aficionado. Avid alcohol specialist. Typical zombie evangelist. Analyst.,4,7,0,8,4,3,6
1713,Unable to type with boxing gloves on. Troublemaker. Web specialist. Internet expert.,4,4,7,9,0,9,5
1714,Proud introvert. Food enthusiast. Evil twitter maven. Award-winning pop culture guru. Lifelong web junkie. General tv scholar.,8,3,8,7,8,1,6
1715,Troublemaker. Beer buff. Evil internet trailblazer. Food junkie. Passionate travel fanatic.,3,0,6,8,2,1,8
1716,Social media specialist. Wannabe analyst. Award-winning coffee lover. Passionate zombie expert.,6,3,5,6,1,3,6
1717,Twitter specialist. Proud food maven. Internetaholic. Future teen idol. Typical student. Travel aficionado.,2,7,1,9,3,4,3
1718,General alcohol practitioner. Extreme baconaholic. Writer. Social media scholar. Total travel nerd.,0,3,9,5,6,2,2
1719,Amateur gamer. Social media fanatic. Total introvert. Freelance writer. Zombie fanatic.,6,5,0,4,2,0,3
1720,Subtly charming tv specialist. Twitter enthusiast. General entrepreneur. Social media trailblazer. Passionate alcohol geek. Foodaholic.,6,2,7,8,1,9,9
1721,Coffee fan. Friendly tv fanatic. Bacon nerd. Thinker. Problem solver. Communicator. Travel maven.,1,4,4,1,3,0,0
1722,Tv specialist. Falls down a lot. Typical troublemaker. Hipster-friendly beer advocate. Food fan.,5,8,2,4,7,5,8
1723,Falls down a lot. Avid coffee guru. Pop culture expert. Prone to fits of apathy. Food fanatic.,2,7,2,2,1,7,6
1724,Amateur pop culture guru. Friendly beer advocate. Passionate web junkie. Unapologetic writer. Proud social mediaholic.,5,9,1,8,4,6,9
1725,Proud travel advocate. Bacon ninja. Writer. Evil reader. Communicator. Creator.,1,6,0,8,0,9,2
1726,Proud pop culture buff. Incurable internet aficionado. Avid communicator. Devoted zombie advocate.,0,2,4,1,2,6,6
1727,Lifelong problem solver. Total bacon trailblazer. Internet fan. Communicator. Social media scholar. Freelance music specialist. General alcohol advocate.,1,9,1,3,4,6,8
1728,Zombie buff. Incurable bacon ninja. Travel junkie. Pop culture specialist. Food trailblazer. Amateur music geek.,6,0,2,7,5,0,4
1729,Pop culture guru. General internet nerd. Total tv junkie. Proud bacon buff. Infuriatingly humble writer.,3,0,4,9,8,8,8
1730,Student. Organizer. Lifelong zombie ninja. Introvert. Social media geek.,0,4,2,7,6,3,0
1731,Unapologetic travel scholar. Twitter specialist. Tv maven. Student. Lifelong introvert.,4,3,6,5,6,1,4
1732,Proud writer. Social media practitioner. Travel trailblazer. Internet ninja. Total tv maven.,0,3,0,3,9,7,2
1733,Bacon scholar. Hipster-friendly food buff. Certified travel practitioner. Evil troublemaker.,1,2,1,9,8,0,9
1734,Professional travel aficionado. Zombieaholic. Web ninja. Gamer. Total communicator. Alcohol advocate. Coffee lover.,3,9,9,6,5,7,4
1735,Pop culture enthusiast. Food aficionado. Twitter fan. Professional social media expert. Zombie ninja.,8,2,7,3,8,7,4
1736,Introvert. Zombie aficionado. Devoted coffee specialist. Award-winning social mediaholic.,3,4,9,3,7,0,5
1737,Wannabe food expert. Problem solver. Zombie specialist. Bacon evangelist. Twitter practitioner.,3,1,1,6,2,6,3
1738,Certified internet buff. Freelance zombie fanatic. Incurable baconaholic. Alcohol enthusiast.,1,5,7,9,3,9,4
1739,Coffee buff. Tv geek. Incurable musicaholic. Hipster-friendly alcohol evangelist.,0,5,8,1,3,9,5
1740,Total beer maven. Certified food buff. General bacon fan. Hipster-friendly communicator. Typical troublemaker. Incurable reader. Friendly internet expert.,5,3,2,1,4,7,6
1741,Incurable alcohol practitioner. Travel ninja. Hardcore twitter trailblazer. Evil troublemaker.,0,8,1,5,5,6,2
1742,Coffee lover. Web specialist. Alcohol enthusiast. Explorer. Social media trailblazer. Lifelong tv geek. Travelaholic.,7,4,3,6,2,0,8
1743,Problem solver. Food guru. Pop culture aficionado. Hardcore web scholar. Passionate social media lover. Zombie buff.,9,1,8,6,4,4,5
1744,Freelance tv maven. Evil zombie fan. Beer nerd. Professional webaholic. Social media trailblazer.,6,3,3,0,9,7,7
1745,Music fanatic. Unapologetic tvaholic. Thinker. Prone to fits of apathy. Hardcore writer. Hipster-friendly zombie lover.,9,6,8,2,4,2,9
1746,Social media scholar. Web specialist. Freelance alcohol evangelist. Twitter practitioner.,0,5,9,9,9,2,4
1747,Coffee ninja. Alcohol lover. Freelance introvert. Proud entrepreneur. Infuriatingly humble web trailblazer.,9,6,2,6,7,6,5
1748,Troublemaker. Thinker. Student. Award-winning internet fanatic. Social media practitioner.,4,5,4,9,5,4,3
1749,Writer. Organizer. Introvert. Problem solver. Twitter specialist. Food maven. Wannabe thinker. Creator. Gamer. Infuriatingly humble reader. Student.,4,6,8,6,0,6,1
1750,Explorer. Tv lover. Incurable troublemaker. Reader. Lifelong food evangelist. Creator. Student. Travel advocate. Alcohol junkie.,6,1,6,7,4,5,9
1751,Infuriatingly humble beer fan. Total music ninja. Web enthusiast. Social media buff. Zombie scholar. Entrepreneur. Devoted reader.,6,3,9,5,5,6,8
1752,Wannabe reader. Alcohol ninja. Infuriatingly humble zombie aficionado. Analyst. Typical creator.,6,2,5,5,9,9,8
1753,Incurable alcohol fan. Hipster-friendly twitter practitioner. Tv trailblazer. Communicator. Travel fanatic.,5,3,5,7,6,4,7
1754,Subtly charming problem solver. Beer buff. Twitter geek. Wannabe food aficionado. Incurable writer.,8,3,6,7,2,5,8
1755,Avid music ninja. Wannabe tv expert. General web fan. Beer practitioner. Lifelong zombie nerd.,5,4,5,3,4,3,3
1756,Entrepreneur. Travel maven. Proud coffee aficionado. Amateur thinker. Pop culture evangelist. Reader. Hipster-friendly bacon enthusiast.,2,1,0,2,9,3,7
1757,Entrepreneur. Lifelong problem solver. Pop culture ninja. Beeraholic. Internet specialist. Gamer. Avid music aficionado. Twitter geek.,0,1,7,8,8,4,2
1758,Webaholic. Tv trailblazer. Hardcore analyst. Coffee enthusiast. Proud reader. Zombie aficionado.,9,9,9,6,7,3,7
1759,Devoted writer. Lifelong explorer. Friendly gamer. Award-winning twitter specialist. Communicator.,8,8,1,3,5,4,3
1760,Coffee buff. Bacon fanatic. Typical twitter maven. Proud student. Entrepreneur. Gamer. General web scholar.,0,4,4,0,4,3,4
1761,Web trailblazer. Coffee practitioner. Twitter aficionado. Bacon fanatic. Social media fan.,8,5,3,2,3,0,8
1762,Devoted twitter lover. Wannabe coffee nerd. Total bacon fanatic. Introvert. Future teen idol. Passionate music expert.,1,1,7,1,8,6,8
1763,Professional travel scholar. Devoted baconaholic. Hipster-friendly alcohol nerd. Internet geek.,3,9,0,8,0,6,2
1764,Troublemaker. Travel aficionado. Creator. Total social media evangelist. Food specialist.,3,5,3,0,5,7,0
1765,Coffee nerd. Beer fanatic. Tv aficionado. Devoted pop culture guru. Infuriatingly humble creator.,9,5,8,7,5,5,3
1766,Thinker. Travel fanatic. Avid social media guru. Extreme tv specialist. Communicator. Bacon maven. Award-winning writer. Explorer. Student.,8,1,6,4,1,4,8
1767,Beer buff. Zombie evangelist. Unapologetic pop cultureaholic. Incurable writer. Introvert.,6,3,1,9,2,8,7
1768,Bacon enthusiast. Amateur zombie fanatic. Music ninja. Unable to type with boxing gloves on.,3,7,6,0,3,9,2
1769,Wannabe internet practitioner. Passionate student. Beer trailblazer. Friendly communicator.,0,9,8,6,3,8,3
1770,Typical twitter evangelist. Analyst. Coffee ninja. Pop culture scholar. Lifelong music enthusiast.,7,4,9,2,2,3,7
1771,Travelaholic. Problem solver. Analyst. Friendly communicator. Bacon junkie.,3,5,7,4,8,0,9
1772,Problem solver. Extreme entrepreneur. Student. Freelance reader. Evil web geek. Tv specialist.,5,6,1,1,4,8,3
1773,Award-winning beer expert. Subtly charming analyst. Infuriatingly humble social media trailblazer.,0,6,4,2,8,4,6
1774,Music expert. Typical internet practitioner. Extreme travel aficionado. Beer ninja. Communicator.,1,1,0,4,9,3,7
1775,Hipster-friendly coffee ninja. Typical analyst. Zombie practitioner. Devoted social mediaholic.,3,2,4,8,1,1,6
1776,Unapologetic entrepreneur. Typical food trailblazer. Bacon advocate. General problem solver. Music guru. Internet fanatic. Pop culture expert. Tv scholar.,5,1,2,2,6,2,9
1777,Wannabe twitter fanatic. Alcohol advocate. Beer evangelist. Thinker. Music expert. Explorer.,2,3,3,5,3,3,5
1778,Subtly charming beer fan. Troublemaker. Explorer. Tv scholar. Lifelong bacon aficionado.,5,0,3,3,0,0,7
1779,Unable to type with boxing gloves on. Musicaholic. Subtly charming bacon aficionado.,2,5,0,8,5,5,8
1780,Beer lover. Hipster-friendly entrepreneur. Bacon buff. Unapologetic communicator. Avid analyst.,7,2,1,9,1,4,3
1781,Evil food fanatic. Reader. Pop culture junkie. Subtly charming twitter geek. Devoted beer maven.,3,3,1,1,2,5,3
1782,Twitter ninja. Zombie evangelist. Coffee practitioner. Student. Beer guru. Gamer.,2,9,8,5,0,5,9
1783,Lifelong alcohol specialist. Professional student. Problem solver. Avid gamer.,6,7,0,9,5,8,6
1784,Writer. Music ninja. General communicator. Subtly charming travel advocate. Zombie junkie.,7,9,8,3,1,1,8
1785,Wannabe travel fanatic. Problem solver. Baconaholic. Award-winning tv advocate. Coffee lover.,6,6,2,9,9,3,3
1786,Organizer. Certified gamer. Extreme zombie maven. Web expert. General bacon scholar.,6,5,1,9,7,0,0
1787,Typical bacon enthusiast. Professional analyst. Wannabe tv nerd. Travel advocate. Coffee buff.,1,7,0,3,8,7,5
1788,Pop culture fanatic. Passionate bacon advocate. Social media enthusiast. Webaholic.,7,4,8,8,8,6,5
1789,Zombie expert. Freelance writer. Friendly travel buff. Thinker. Troublemaker. Hipster-friendly music practitioner.,6,3,8,3,1,5,1
1790,Zombie specialist. Beer lover. Alcohol nerd. Freelance entrepreneur. Proud travel advocate.,9,6,0,2,4,1,7
1791,Lifelong gamer. Web nerd. Twitter evangelist. Troublemaker. Beer practitioner. Music fanatic.,3,0,1,2,0,5,5
1792,Infuriatingly humble music junkie. Professional gamer. Internet advocate. Certified introvert.,3,7,4,9,7,5,1
1793,Zombie scholar. Twitter fanatic. Friend of animals everywhere. Bacon geek. Certified alcohol buff. Proud coffee advocate. Award-winning travel enthusiast.,2,6,5,7,5,0,5
1794,Lifelong twitter buff. Freelance student. Prone to fits of apathy. Analyst. Incurable beer expert. Music nerd. Tv geek.,3,4,7,8,9,5,0
1795,Hipster-friendly pop culture enthusiast. Amateur introvert. Evil thinker. Typical music junkie. Web expert. Tv fanatic.,0,9,9,6,3,0,1
1796,Friend of animals everywhere. Web guru. Organizer. Food geek. Amateur tv fanatic. Coffee trailblazer. Alcohol junkie.,3,5,3,2,0,7,2
1797,Proud coffee ninja. Total gamer. Webaholic. Music geek. Writer. Bacon advocate. Amateur reader. Devoted food expert.,7,1,6,9,9,6,3
1798,Alcohol advocate. Social media fanatic. Freelance reader. Professional zombie expert.,7,5,0,3,9,6,6
1799,General beer scholar. Professional web junkie. Food buff. Social media specialist. Analyst. Music practitioner. Pop culture lover.,7,4,0,1,5,7,9
1800,Freelance web maven. Tv advocate. Pop culture buff. Food specialist. Musicaholic.,0,9,4,0,2,3,8
1801,Unable to type with boxing gloves on. Certified twitter expert. Food guru. Typical coffee ninja.,0,3,9,2,8,3,9
1802,Award-winning coffee maven. Tv expert. Entrepreneur. Evil social media fanatic. Music advocate.,5,5,6,9,5,0,9
1803,Reader. Hipster-friendly food junkie. Friendly pop culture fanatic. Entrepreneur. Certified webaholic.,8,7,7,8,1,0,1
1804,Music aficionado. Creator. Food geek. Introvert. Internet maven. Social media guru.,1,5,7,1,8,0,8
1805,General analyst. Tv advocate. Devoted travel buff. Communicator. Extreme pop culture maven.,6,0,0,5,8,9,5
1806,Travel enthusiast. Social media geek. Zombie fanatic. Infuriatingly humble twitter evangelist.,1,1,3,7,2,7,9
1807,Twitter fanatic. Incurable pop culture junkie. Entrepreneur. Avid student. Alcohol fanatic.,1,4,0,1,7,6,1
1808,Amateur alcohol maven. Music scholar. Friendly reader. Subtly charming twitter nerd. Lifelong tv lover. Certified problem solver. Passionate internet advocate.,1,0,4,3,3,1,3
1809,Infuriatingly humble bacon fanatic. Prone to fits of apathy. Gamer. Passionate student.,2,8,7,7,0,6,7
1810,Total web guru. Creator. Award-winning travel evangelist. Bacon fan. Introvert. Beer advocate. Coffee maven.,3,3,7,5,8,9,3
1811,Typical twitter junkie. Introvert. Web expert. Travel lover. Problem solver. Wannabe social media advocate.,4,1,7,8,2,8,9
1812,Prone to fits of apathy. Wannabe travel lover. Zombie practitioner. Alcohol guru. Reader. Tv maven.,2,5,8,3,9,6,2
1813,Total twitteraholic. Alcohol fanatic. Devoted bacon ninja. Wannabe web evangelist. Professional travel maven. Student.,0,2,0,6,6,8,4
1814,Webaholic. Hipster-friendly explorer. Proud pop culture lover. Avid student.,8,9,6,5,7,6,1
1815,Unable to type with boxing gloves on. Gamer. Proud zombie junkie. Communicator.,9,1,0,6,7,7,5
1816,Internet expert. Twitter buff. Social media trailblazer. Proud alcohol practitioner. Gamer.,1,8,6,3,0,8,6
1817,Troublemaker. Alcohol advocate. Total student. Future teen idol. Hardcore bacon fanatic. Evil introvert.,8,5,0,9,4,7,8
1818,Total food expert. Coffee ninja. Zombie specialist. Internet enthusiast. Hipster-friendly web nerd.,4,6,1,3,4,1,4
1819,Food trailblazer. Troublemaker. Zombie scholar. Devoted analyst. Twitter buff. General alcohol guru. Evil coffee lover.,8,2,2,5,7,3,9
1820,Proud zombie specialist. Wannabe web lover. Friendly internet enthusiast. Student. Freelance tv scholar. Organizer.,7,4,6,6,0,0,4
1821,Freelance music geek. Bacon buff. Social media junkie. Beer enthusiast. Writer. Hardcore pop culture lover. Reader.,6,2,3,4,3,8,3
1822,Total internet junkie. Lifelong web lover. Future teen idol. Beer trailblazer. Social mediaholic. Friend of animals everywhere.,1,3,0,1,2,1,2
1823,Devoted reader. Alcoholaholic. Coffee nerd. Evil organizer. Analyst. Passionate troublemaker.,5,8,5,9,9,0,9
1824,Typical problem solver. General entrepreneur. Incurable internet nerd. Explorer. Wannabe pop culture enthusiast.,5,1,0,5,8,5,6
1825,Passionate web enthusiast. Infuriatingly humble internet trailblazer. Unapologetic music fan. Award-winning introvert. Bacon advocate. Extreme entrepreneur.,5,2,3,8,2,4,5
1826,Pop culture practitioner. Award-winning zombie scholar. Beer maven. Web fan. Music expert. Wannabe student. Freelance twitter ninja.,3,6,7,1,8,0,0
1827,Travel maven. Analyst. Web scholar. Professional alcohol lover. Twitteraholic. Freelance reader. Typical bacon ninja.,3,7,7,4,8,3,1
1828,Entrepreneur. Zombie guru. Social media scholar. Certified coffee evangelist. Passionate creator. Thinker. Student.,6,2,4,3,6,3,9
1829,Devoted music fan. Tv trailblazer. Hipster-friendly internet guru. Communicator. Typical web lover.,9,8,3,5,6,5,3
1830,Evil social media fanatic. Extreme alcohol aficionado. Analyst. Bacon guru.,6,2,1,1,3,0,2
1831,Twitter fan. Certified coffee trailblazer. Reader. Freelance entrepreneur. Total analyst.,0,7,2,5,1,5,9
1832,Explorer. Travel specialist. Wannabe thinker. Extreme troublemaker. Lifelong communicator.,8,1,8,2,1,7,8
1833,Certified explorer. Avid creator. Incurable tv maven. Pop culture trailblazer. Amateur coffee expert. Web fanatic.,7,9,0,1,2,3,1
1834,Web guru. Social media lover. Coffee junkie. Freelance twitter aficionado. Pop culture ninja. Food evangelist. Reader.,3,2,5,6,4,8,5
1835,General beer junkie. Friendly gamer. Student. Social media buff. Unapologetic travel nerd.,8,2,4,5,9,3,9
1836,Proud analyst. Award-winning social media aficionado. Thinker. Coffee fan. Web trailblazer.,4,7,5,6,0,0,9
1837,Entrepreneur. Amateur gamer. Zombie advocate. Infuriatingly humble communicator. Proud reader.,8,8,4,3,9,3,1
1838,Internetaholic. Tv enthusiast. Amateur travel fanatic. Proud organizer. Problem solver. Food lover. Twitter practitioner. Zombie geek.,5,6,1,5,5,8,4
1839,Friendly reader. Hardcore explorer. Typical bacon aficionado. Award-winning coffeeaholic.,2,9,3,9,0,3,1
1840,Certified beer fanatic. Proud analyst. Troublemaker. Travel maven. Subtly charming twitter enthusiast. Total internet practitioner. Gamer.,9,6,4,5,6,4,4
1841,Gamer. Creator. Award-winning beer buff. Unable to type with boxing gloves on. Introvert. Passionate analyst. Music maven.,3,9,4,7,6,0,3
1842,Certified explorer. General twitter aficionado. Student. Hardcore communicator.,9,4,1,5,7,2,4
1843,Unapologetic bacon fan. Proud creator. Entrepreneur. Freelance food junkie. Infuriatingly humble internet trailblazer.,4,6,6,2,6,3,8
1844,Tv maven. Passionate bacon evangelist. Travel fanatic. Social media geek. Coffee guru. Beer buff. Hardcore twitter fanatic.,7,9,4,2,5,4,5
1845,Total web fanatic. Devoted twitter maven. Infuriatingly humble music specialist. Social media advocate. Zombie trailblazer. Food geek.,4,9,0,8,2,3,1
1846,Twitter advocate. Proud student. Devoted internet specialist. Pop culture aficionado.,0,2,7,8,1,4,6
1847,General bacon maven. Pop culture trailblazer. Infuriatingly humble organizer. Twitter specialist. Avid problem solver.,8,8,1,0,4,2,4
1848,Proud creator. Music buff. Professional zombie advocate. Troublemaker. Twitter nerd. Freelance alcohol fanatic. Tv enthusiast. Bacon scholar. Falls down a lot.,4,8,5,2,8,1,0
1849,Subtly charming gamer. Entrepreneur. Wannabe bacon maven. Beer enthusiast. Friendly organizer.,9,1,4,7,1,3,1
1850,Internetaholic. Hardcore social media junkie. Certified tv evangelist.,0,0,3,8,2,3,2
1851,Certified thinker. Creator. Freelance writer. Music fan. Total alcohol lover.,6,5,3,8,1,3,0
1852,Zombie guru. Food buff. Wannabe bacon fanatic. Twitter nerd. Unapologetic social media junkie. Devoted music expert.,9,6,9,4,4,2,5
1853,Entrepreneur. Travel advocate. Devoted organizer. Wannabe social media fanatic. Certified tv maven.,8,8,2,9,3,5,5
1854,Passionate thinker. Wannabe music ninja. Tv geek. Bacon aficionado. Alcohol expert.,8,8,9,1,4,9,6
1855,Troublemaker. Devoted thinker. General communicator. Wannabe internet maven.,3,0,1,9,8,0,2
1856,Organizer. Explorer. Writer. General travel ninja. Music specialist. Problem solver. Coffee fan.,0,4,8,4,4,2,4
1857,Internet lover. Freelance troublemaker. Certified pop culture junkie. Evil student. Subtly charming explorer.,2,3,4,8,6,8,5
1858,Tv specialist. Unapologetic gamer. Beer advocate. Typical reader. Professional entrepreneur.,7,2,2,1,8,2,9
1859,Troublemaker. Unapologetic social media practitioner. Alcohol advocate. Internet ninja.,8,4,7,6,5,7,4
1860,Alcohol aficionado. Reader. Thinker. Bacon junkie. Certified travel fanatic.,9,1,9,6,5,8,5
1861,Infuriatingly humble gamer. Analyst. Music scholar. Tv fan. Travel ninja. Unapologetic internet enthusiast. Evil problem solver. Reader. Devoted food fanatic.,2,4,0,1,9,2,7
1862,Passionate troublemaker. Reader. Evil alcohol junkie. Zombie ninja. Gamer. Beer guru. Subtly charming web evangelist.,3,2,7,2,6,1,1
1863,Creator. Internet ninja. Communicator. Proud twitter trailblazer. Coffee advocate. Alcohol geek.,7,7,7,2,8,8,8
1864,Certified zombie fanatic. Alcohol guru. Prone to fits of apathy. Subtly charming coffee geek. Passionate bacon scholar. Travel fanatic.,9,1,3,9,2,3,0
1865,Entrepreneur. Hipster-friendly web enthusiast. Twitter trailblazer. Extreme communicator.,6,1,6,1,1,6,3
1866,Typical introvert. Internet fanatic. Devoted music nerd. Reader. Writer. Bacon ninja. Food practitioner. Proud travel lover. Web guru.,9,6,2,2,9,7,5
1867,Certified social media geek. Freelance travel fanatic. Professional web junkie. Tv evangelist. Unapologetic gamer. Incurable baconaholic.,8,5,0,9,5,6,2
1868,Total pop culture fanatic. Incurable bacon aficionado. Zombie expert. Travel fan. Lifelong gamer.,7,2,9,8,7,1,6
1869,Proud student. Thinker. Professional organizer. Amateur tv practitioner. Freelance entrepreneur.,0,1,5,2,5,9,9
1870,Friendly alcohol specialist. Prone to fits of apathy. Zombie geek. Social media expert.,4,9,7,5,4,4,6
1871,Evil alcohol nerd. Introvert. Bacon expert. Social media advocate. Zombie practitioner.,4,9,7,5,2,8,6
1872,Wannabe travel fan. Evil twitteraholic. Professional social media geek. Total beer advocate. Writer. Zombie junkie.,5,1,1,5,7,8,7
1873,Bacon expert. Lifelong introvert. Certified beer junkie. Total food fanatic. Typical gamer.,9,0,9,6,3,2,0
1874,Student. Internet fanatic. Twitter buff. Zombie junkie. Creator. Explorer. Alcohol fan. General music maven.,7,3,3,7,1,4,4
1875,Award-winning entrepreneur. Hipster-friendly food buff. Web geek. Tv fan. Social mediaholic. Music specialist. Analyst.,2,6,5,2,7,8,7
1876,Alcohol enthusiast. Writer. Thinker. Pop culture specialist. Amateur web fanatic. Explorer.,9,3,9,4,2,4,5
1877,Devoted bacon fan. Lifelong twitter fanatic. Music ninja. Subtly charming social media practitioner. Tv evangelist.,8,5,7,6,5,8,8
1878,Writer. Creator. Unable to type with boxing gloves on. Web enthusiast. Food specialist. Analyst.,2,6,6,3,7,3,6
1879,Evil explorer. General twitter aficionado. Hipster-friendly pop culture expert. Student.,6,1,7,2,1,6,3
1880,Hardcore web guru. Communicator. Introvert. Infuriatingly humble beer nerd. Evil music practitioner. Typical problem solver.,1,6,9,5,0,8,1
1881,Lifelong coffee nerd. Web fan. Pop culture trailblazer. Hipster-friendly music buff. Bacon fanatic. Unapologetic social media lover.,1,0,6,0,8,3,5
1882,Proud pop culture guru. Social media evangelist. Typical beer lover. Communicator.,8,1,7,1,6,7,3
1883,Wannabe explorer. Bacon practitioner. Subtly charming pop culture aficionado. Certified reader.,0,4,2,9,4,5,3
1884,Wannabe tv junkie. Devoted alcohol guru. Explorer. Award-winning zombie buff. Evil web evangelist. Travel lover.,6,5,4,8,2,8,2
1885,Unable to type with boxing gloves on. Zombie evangelist. Entrepreneur.,9,3,9,0,2,4,8
1886,Extreme organizer. Baconaholic. Explorer. Twitter junkie. Web ninja. Music enthusiast. Beer maven. Creator.,1,5,7,9,5,9,1
1887,Alcohol buff. Extreme food expert. Creator. Social media fanatic. Web fan. Bacon nerd.,1,6,3,3,2,9,9
1888,Gamer. Hipster-friendly explorer. Social mediaholic. General bacon scholar. Award-winning tv buff. Coffee fanatic.,8,0,2,6,6,5,1
1889,Subtly charming entrepreneur. Beer maven. Amateur gamer. Web evangelist. Social media lover.,6,6,0,9,3,1,3
1890,Passionate internet junkie. Professional pop culture specialist. Zombie fanatic. Music guru.,6,1,0,3,9,3,0
1891,Avid internet geek. Extreme bacon enthusiast. Certified thinker. Alcohol practitioner.,3,2,4,0,7,2,5
1892,Total music enthusiast. Extreme explorer. Communicator. Organizer. Tv trailblazer. Hipster-friendly bacon fanatic. Introvert.,8,8,1,8,2,9,9
1893,General beer nerd. Communicator. Avid tv ninja. Devoted student. Professional explorer.,9,3,4,5,5,8,7
1894,Coffee maven. Social mediaholic. Prone to fits of apathy. Travel expert. Pop culture junkie. Bacon geek. Food guru.,1,4,4,6,9,9,9
1895,Hipster-friendly travelaholic. Amateur twitter fanatic. Thinker. Devoted gamer.,0,6,1,2,4,1,6
1896,Web junkie. Communicator. Lifelong explorer. Avid alcohol evangelist. Bacon advocate. Social media trailblazer.,7,2,7,7,5,8,1
1897,Bacon advocate. Web buff. Internet scholar. Creator. Introvert. Travel specialist. Reader.,0,5,9,1,3,3,7
1898,Beer buff. Travel fan. Infuriatingly humble alcohol nerd. Total web geek. Hardcore tv aficionado.,5,7,0,8,2,8,7
1899,General beer fan. Unapologetic alcohol scholar. Social media geek. Subtly charming tv advocate.,4,0,8,2,5,0,8
1900,Friendly social media buff. Thinker. Web scholar. Lifelong gamer.,9,0,7,1,4,6,4
1901,Travel aficionado. Incurable bacon specialist. Tv evangelist. Wannabe internet enthusiast. Typical creator.,0,2,8,4,3,7,7
