,Bios,Movies,TV,Religion,Music,Sports,Books,Politics
3365,Hipster-friendly twitter fanatic. Infuriatingly humble tv advocate. Musicaholic. Explorer.,8,6,9,9,6,0,6
3366,Certified webaholic. Food maven. Beer practitioner. Hipster-friendly social media fanatic. Student. Zombie evangelist.,9,4,9,8,9,8,2
3367,Certified music aficionado. Explorer. General bacon maven. Alcohol expert. Web trailblazer.,7,5,2,8,4,0,9
3368,Amateur web evangelist. Zombie practitioner. Travelaholic. Lifelong beer guru. Proud gamer. Bacon specialist.,1,9,4,1,0,4,3
3369,Thinker. Twitter scholar. Introvert. Amateur internet maven. Hardcore analyst. Troublemaker.,9,5,4,0,8,9,9
3370,Pop culture enthusiast. Amateur zombie fanatic. Wannabe entrepreneur. Organizer. Web buff.,6,5,4,1,4,1,8
3371,Friend of animals everywhere. Amateur reader. Lifelong entrepreneur. Food guru. Explorer. Incurable social media geek. Freelance web advocate. Communicator.,7,8,2,1,7,8,7
3372,Tv maven. Hipster-friendly coffee geek. Reader. Gamer. Incurable pop culture fanatic. Lifelong food lover. Evil analyst. Twitter expert.,2,7,5,8,1,9,5
3373,Gamer. Extreme twitter advocate. Avid food fan. Subtly charming analyst. Unapologetic bacon geek.,9,8,2,5,1,8,3
3374,Friend of animals everywhere. Proud internet fanatic. Coffee aficionado. Reader. Creator.,8,6,9,3,4,8,1
3375,Travel ninja. Avid zombie expert. Twitter fanatic. Hipster-friendly introvert. Communicator. Amateur social mediaholic.,8,4,5,8,0,5,8
3376,Typical tv ninja. Reader. Infuriatingly humble troublemaker. Social media maven. Writer. Introvert.,1,9,5,8,4,0,7
3377,Passionate reader. Web ninja. Gamer. Zombie fanatic. Travel nerd. Food trailblazer. Bacon maven.,5,0,3,6,2,7,7
3378,Unable to type with boxing gloves on. Beer trailblazer. Devoted food nerd. Writer. Analyst.,2,9,2,4,5,3,0
3379,Beer geek. Subtly charming internet junkie. General twitter advocate. Pop culture specialist. Web fanatic. Total zombie trailblazer.,6,2,1,1,7,5,2
3380,General social media evangelist. Communicator. Explorer. Friendly travel trailblazer. Music practitioner.,8,7,8,2,0,0,1
3381,Friendly web buff. Food maven. Coffee specialist. Professional alcohol fanatic. Creator.,3,1,4,5,3,2,1
3382,Typical beer expert. Certified explorer. Thinker. Travel nerd. Proud entrepreneur.,5,0,1,3,6,0,9
3383,Zombie maven. Alcohol ninja. Pop culture fan. Thinker. Music practitioner. Twitter enthusiast. Internet aficionado.,6,3,1,7,5,9,2
3384,Communicator. Friendly explorer. Extreme social media trailblazer. Bacon junkie. Lifelong beer practitioner. Incurable coffee advocate.,8,2,9,4,5,1,8
3385,Wannabe alcoholaholic. Organizer. Pop culture fanatic. Professional food fanatic. Hardcore gamer.,1,0,4,6,5,9,2
3386,General introvert. Zombie fanatic. Twitter practitioner. Internet geek. Explorer. Extreme coffee nerd. Social media buff. Freelance pop culture scholar.,3,0,9,1,5,3,6
3387,Typical travel expert. Bacon guru. Creator. Zombie advocate. Food trailblazer. Subtly charming problem solver. Extreme beer fan.,1,8,4,9,4,1,3
3388,Unapologetic bacon scholar. Coffee geek. Incurable creator. Tv evangelist. Devoted beer nerd. Professional internet practitioner.,1,7,5,9,9,4,8
3389,Pop culture practitioner. Troublemaker. Internet fan. Lifelong bacon guru. Subtly charming reader.,8,3,1,6,2,7,0
3390,Explorer. Pop culture ninja. Subtly charming web evangelist. Introvert. Wannabe twitter advocate. Writer. Zombie fanatic. Music maven. Evil organizer.,7,3,8,9,4,3,0
3391,Unapologetic troublemaker. Amateur writer. Social media practitioner. Twitter expert. Total coffee guru. Evil internet geek.,9,3,0,7,1,2,3
3392,Hipster-friendly travel trailblazer. Pop culture specialist. Incurable food ninja. Unapologetic analyst. Alcohol fan.,6,2,2,4,7,1,4
3393,Internet geek. Avid organizer. Infuriatingly humble student. Devoted social media advocate. Unapologetic twitter ninja.,4,7,5,0,4,0,6
3394,Hipster-friendly coffee practitioner. Award-winning alcohol expert. Tv ninja. Explorer. Wannabe organizer.,1,1,9,8,0,1,0
3395,Internet evangelist. Social media enthusiast. Avid coffee guru. Communicator. Music practitioner. Freelance student.,3,0,9,4,9,6,6
3396,Thinker. Social media maven. Student. Tv trailblazer. Proud writer. Evil travel geek. Creator.,8,9,2,8,8,2,4
3397,Hipster-friendly zombie nerd. Writer. Extreme social media specialist.,4,5,6,3,8,2,4
3398,Writer. Infuriatingly humble music fanatic. Proud internet fanatic. Evil zombie fan. Extreme alcohol buff. Food ninja. Social media expert.,6,9,6,8,0,4,5
3399,Hardcore thinker. Typical communicator. Extreme troublemaker. Twitter aficionado. Introvert.,2,6,9,3,2,0,9
3400,Communicator. Typical social media ninja. Pop culture practitioner. Avid twitter guru. Devoted zombie enthusiast.,9,6,8,9,9,4,8
3401,Freelance alcohol scholar. Zombie enthusiast. Bacon buff. Tv trailblazer.,0,0,5,1,3,9,7
3402,Explorer. Travel advocate. Hardcore twitter enthusiast. Food fanatic. Subtly charming pop culture trailblazer. Coffee aficionado.,5,6,0,7,4,1,8
3403,Evil analyst. Freelance thinker. Devoted bacon maven. Hardcore writer. Proud explorer. Subtly charming introvert. Pop cultureaholic. General beer scholar.,2,5,9,3,4,3,8
3404,Subtly charming beer expert. Extreme twitter geek. Total social mediaholic.,9,7,1,5,3,0,6
3405,Evil communicator. Incurable coffee trailblazer. Travel junkie. Beeraholic. Music expert. General internet guru.,1,0,7,7,2,1,3
3406,Friendly tv lover. Future teen idol. Devoted beer practitioner. Internet guru. Food junkie.,8,3,5,6,7,5,0
3407,Web fanatic. Food specialist. Friendly coffee expert. General student. Incurable writer.,6,8,0,8,5,0,9
3408,General travel scholar. Problem solver. Wannabe internet ninja. Web aficionado. Reader. Extreme zombie expert.,0,2,1,0,4,1,8
3409,Avid coffee guru. Unapologetic beer nerd. Pop culture geek. Web lover. Devoted food trailblazer.,8,7,1,0,9,1,9
3410,Gamer. Extreme troublemaker. Friend of animals everywhere. Creator. Entrepreneur.,6,1,4,8,5,7,4
3411,Unapologetic creator. Reader. General music ninja. Lifelong beer specialist. Communicator. Organizer. Introvert.,7,5,9,5,3,2,9
3412,Social media nerd. Beer guru. Pop culture maven. Internet junkie. Tv scholar.,7,2,5,9,5,6,5
3413,Falls down a lot. Certified web specialist. Analyst. Bacon trailblazer. Introvert. Writer. Gamer.,0,8,9,0,1,6,4
3414,Twitter scholar. Travel expert. Passionate gamer. Problem solver. Extreme troublemaker. Tv enthusiast.,2,2,1,5,3,8,0
3415,Extreme social media fan. Reader. Freelance web maven. Twitter ninja. Travel aficionado.,8,7,1,2,1,2,2
3416,General pop culture ninja. Alcohol nerd. Unapologetic beeraholic. Extreme thinker. Food lover.,5,5,2,7,5,7,1
3417,Web expert. Avid entrepreneur. Professional social media trailblazer. Problem solver. Wannabe communicator. Certified pop cultureaholic.,1,7,1,1,8,2,8
3418,Typical web junkie. Hardcore twitter ninja. Professional zombie trailblazer. Reader.,0,5,1,7,2,7,3
3419,Writer. Hardcore bacon specialist. Passionate alcohol ninja. Typical web fanatic. Avid twitter fanatic. Unapologetic coffee guru.,9,6,5,2,6,1,1
3420,General zombie buff. Reader. Wannabe troublemaker. Typical analyst. Twitter aficionado.,4,7,9,1,5,9,9
3421,Alcohol maven. Web ninja. Beer advocate. Future teen idol. Travel aficionado. Communicator.,9,5,7,0,9,3,0
3422,Unapologetic zombie junkie. Evil tv advocate. Proud writer. Extreme gamer. Award-winning creator. Incurable alcohol fanatic. Student.,1,9,3,4,7,7,4
3423,Freelance zombie junkie. Award-winning tv nerd. Twitter aficionado. Travel geek.,2,2,8,0,9,3,0
3424,Web fanatic. Typical writer. Internet evangelist. Creator. Twitter junkie.,8,5,8,7,4,9,6
3425,Award-winning web maven. Incurable pop culture geek. Extreme food evangelist. Tv specialist. Beer trailblazer.,4,0,4,0,3,2,5
3426,Hipster-friendly bacon buff. Incurable twitter fanatic. Award-winning tv advocate.,3,3,7,8,7,2,7
3427,Hardcore introvert. Beer trailblazer. Avid internet lover. Analyst. Food specialist. Certified social media aficionado.,8,9,7,1,3,7,1
3428,Entrepreneur. Zombie guru. Social media scholar. Certified coffee evangelist. Passionate creator. Thinker. Student.,3,1,2,6,7,1,9
3429,Tv trailblazer. Incurable web evangelist. Future teen idol. Thinker. Food scholar. Entrepreneur. Total troublemaker. Alcohol lover. Explorer. Evil beer geek.,3,5,3,9,3,9,1
3430,Hardcore creator. Incurable zombie ninja. Reader. Award-winning bacon junkie. Travel practitioner.,3,0,0,9,7,9,6
3431,Award-winning travel scholar. Hipster-friendly internet ninja. Coffee lover. Future teen idol. Friendly reader. Tv buff. Introvert.,3,2,8,5,5,0,6
3432,Subtly charming beer evangelist. Bacon practitioner. Infuriatingly humble travel enthusiast. Pop culture buff. Certified communicator.,2,4,8,7,1,8,7
3433,Zombie maven. Hipster-friendly internet evangelist. Organizer. Communicator. Pop culture fanatic. Web junkie.,4,9,3,7,9,9,1
3434,Music scholar. Food specialist. Travel nerd. Certified internet trailblazer. Beer geek.,6,2,1,4,3,6,9
3435,Creator. Travel evangelist. Explorer. Incurable zombie fan. Internet advocate. Coffee expert.,9,1,0,7,9,6,9
3436,Hardcore alcohol advocate. Falls down a lot. Avid explorer. General travel scholar.,2,6,7,6,1,9,5
3437,Extreme introvert. Tv trailblazer. Evil creator. Social media lover. Beer maven. Hipster-friendly coffee practitioner. Total food nerd.,8,7,1,7,2,5,9
3438,Proud problem solver. Alcohol fan. Internet lover. Friendly food buff. Hardcore troublemaker.,5,8,3,2,9,6,4
3439,Entrepreneur. Bacon ninja. Social media practitioner. Creator. Music enthusiast. Zombie fan.,3,3,2,8,7,8,6
3440,Evil social media trailblazer. Passionate introvert. Travel fan. Friend of animals everywhere. Creator. Entrepreneur.,1,3,6,3,1,7,0
3441,Zombie guru. Falls down a lot. Creator. Hipster-friendly troublemaker. Passionate web ninja. Avid pop culture fanatic.,2,9,7,8,1,4,1
3442,Friendly problem solver. Subtly charming student. Web enthusiast. Friend of animals everywhere. Evil organizer. Freelance pop culture geek.,9,9,8,8,4,5,3
3443,Professional beer practitioner. General travel lover. Freelance entrepreneur. Food fanatic. Lifelong reader.,2,5,2,9,8,5,3
3444,Social media ninja. Wannabe beer fanatic. Tv aficionado. Gamer. Hipster-friendly explorer.,3,2,5,6,1,4,6
3445,Proud tvaholic. Internet fan. Alcohol specialist. Twitter advocate. Bacon trailblazer. Coffee guru.,5,1,8,9,4,5,2
3446,Coffee specialist. Troublemaker. Communicator. Passionate food fanatic. Alcohol fanatic. Explorer.,5,2,6,0,7,0,0
3447,Music specialist. Travel buff. Analyst. Explorer. Professional problem solver. Devoted pop culture fanatic.,8,8,8,0,9,8,1
3448,Professional web specialist. Food junkie. Amateur music nerd. Travel geek. Avid zombie guru. Hardcore troublemaker.,9,3,5,3,5,1,8
3449,Entrepreneur. Organizer. Proud twitter trailblazer. Freelance student. Lifelong gamer. Devoted tv nerd. Travel expert. Alcohol fanatic.,8,6,6,2,4,5,3
3450,Writer. Student. Total music guru. Problem solver. Coffee fanatic. Certified organizer.,2,4,9,4,9,9,9
3451,Proud communicator. Bacon ninja. Social media buff. Alcohol practitioner. Hardcore web fan.,7,8,7,0,4,9,1
3452,Analyst. Amateur student. Creator. Infuriatingly humble pop culture fanatic. Devoted reader. Subtly charming beer geek.,1,6,9,4,9,0,8
3453,Writer. Typical social media fanatic. Award-winning alcohol fan. Infuriatingly humble music scholar.,7,1,3,7,1,1,9
3454,Student. Introvert. Twitter guru. Lifelong writer. Zombie ninja. Tv buff. Evil bacon geek. Beer evangelist. Award-winning music lover.,1,4,4,3,2,4,5
3455,Tv geek. Friendly writer. Beer maven. Unapologetic social media advocate.,3,2,0,8,5,5,8
3456,Music trailblazer. Incurable coffee maven. Problem solver. Unable to type with boxing gloves on.,1,9,4,7,1,1,0
3457,Avid beer guru. General gamer. Alcohol fanatic. Professional creator. Extreme pop culture enthusiast. Proud travel scholar. Prone to fits of apathy. Thinker.,8,9,3,2,1,6,2
3458,Total explorer. Freelance writer. Coffee nerd. Incurable web maven. Musicaholic.,3,5,9,3,4,3,6
3459,Hardcore communicator. Lifelong tv expert. Beer practitioner. Introvert. Web junkie. Professional twitter advocate.,7,0,2,9,6,5,5
3460,Web trailblazer. Gamer. Friend of animals everywhere. Freelance coffee fan. Avid creator.,8,0,8,3,3,9,5
3461,Evil internet practitioner. Travel fan. Coffee fanatic. Twitter expert.,0,0,0,4,6,6,2
3462,Gamer. Explorer. Freelance entrepreneur. Introvert. Bacon enthusiast. Beer ninja.,8,4,4,8,5,4,1
3463,Alcohol lover. Future teen idol. Introvert. Zombie evangelist. Hipster-friendly beer trailblazer.,2,0,3,4,1,0,6
3464,Award-winning twitter nerd. Typical reader. Zombie practitioner. Avid social media fanatic. Music trailblazer. Passionate beer geek.,5,1,6,2,5,3,0
3465,Future teen idol. Incurable travel practitioner. Devoted reader. Gamer. Zombie advocate. Analyst.,7,3,1,5,4,9,3
3466,Freelance food fanatic. Falls down a lot. Hipster-friendly twitter buff. Travel evangelist. Professional student.,6,6,8,2,4,0,9
3467,Hardcore reader. Freelance food advocate. Beer buff. Creator. Introvert. Avid writer. Thinker.,8,2,1,9,2,9,1
3468,Introvert. Unapologetic organizer. Incurable entrepreneur. Social media advocate.,9,4,5,6,2,7,7
3469,Tvaholic. Internet scholar. Hardcore travel evangelist. Friendly web trailblazer. Wannabe food fan. Subtly charming twitter nerd.,3,2,8,1,8,8,4
3470,Problem solver. Freelance tv specialist. Award-winning alcohol practitioner. Devoted web nerd.,6,7,2,5,5,5,7
3471,Professional twitter guru. Beer buff. Friendly bacon advocate. Future teen idol. Reader. Communicator. Tv fanatic.,1,8,8,7,6,5,5
3472,Subtly charming twitteraholic. Travel buff. Award-winning introvert. Analyst. Amateur coffee scholar. Evil tv nerd. Devoted music lover. Food guru.,4,4,1,2,0,8,8
3473,Hipster-friendly coffee lover. Pop culture aficionado. Social media specialist. Writer. Thinker. Musicaholic.,0,3,1,4,1,1,8
3474,Zombie nerd. Avid bacon fan. Internetaholic. Lifelong food geek. Amateur introvert. Unapologetic beer buff.,3,1,7,7,8,1,8
3475,Internet advocate. Zombie enthusiast. Troublemaker. Social media buff. Award-winning bacon maven.,9,2,6,2,1,9,1
3476,Bacon expert. Zombie buff. Beer specialist. Extreme internet ninja. Coffee practitioner. Friendly social media fanatic.,2,7,2,9,6,2,1
3477,Award-winning pop culture trailblazer. General zombie scholar. Organizer. Evil web buff. Writer.,0,1,4,8,4,7,8
3478,Total reader. Unapologetic twitter buff. Freelance travel evangelist. Lifelong internet fan.,9,1,1,8,0,7,6
3479,Wannabe beer expert. Alcohol ninja. Twitter specialist. Certified coffee practitioner. Gamer.,8,5,7,3,4,4,3
3480,Twitter lover. Friendly thinker. Avid zombie expert. Analyst. Hipster-friendly creator.,6,5,9,8,0,2,7
3481,Beer enthusiast. Passionate alcohol geek. Freelance music fanatic. Introvert. Web junkie.,5,0,7,8,8,9,2
3482,Internet maven. Organizer. Music advocate. Unapologetic food trailblazer. Analyst. Twitter fanatic.,8,0,1,5,4,5,1
3483,Freelance music lover. Twitter advocate. Beer buff. Certified food evangelist. Alcohol specialist.,8,4,6,9,5,8,1
3484,Gamer. Thinker. Entrepreneur. Beer lover. Twitter specialist. Subtly charming writer. Amateur creator. Prone to fits of apathy.,4,0,7,8,0,7,9
3485,Wannabe social media lover. Certified music geek. Amateur introvert.,7,9,6,8,4,5,7
3486,Alcohol expert. Hipster-friendly twitter nerd. Extreme tv junkie. Explorer. Food geek.,9,9,9,0,2,2,0
3487,Alcohol maven. Friendly problem solver. Creator. Hipster-friendly thinker.,8,3,7,4,8,9,5
3488,Devoted zombie scholar. Web fan. Problem solver. Tv junkie. General entrepreneur. Explorer. Extreme food expert.,3,8,5,4,4,4,5
3489,Devoted internet specialist. Reader. Entrepreneur. Writer. Lifelong music trailblazer.,6,0,0,8,3,9,2
3490,Certified music scholar. Beer guru. Incurable gamer. Total creator. Travel buff. Twitter expert.,5,4,8,3,1,5,2
3491,Avid tv fan. Music evangelist. Hardcore alcohol advocate. Typical travel enthusiast. Evil beer trailblazer.,6,4,7,2,0,8,9
3492,Infuriatingly humble alcohol lover. Bacon scholar. Music enthusiast. Beer fanatic. Zombie ninja.,0,7,7,9,2,9,9
3493,Twitter geek. Typical communicator. Freelance music aficionado. Award-winning writer. Tv scholar.,3,0,9,9,4,6,3
3494,Analyst. Proud pop culture advocate. Devoted travel fanatic. Lifelong bacon junkie. Social media buff. Future teen idol. Freelance alcohol scholar.,2,3,0,5,4,5,3
3495,Music scholar. Wannabe tv guru. Lifelong reader. Food trailblazer.,4,4,0,2,9,7,6
3496,Web guru. Avid bacon practitioner. Typical food fanatic. Friendly beer geek.,9,1,4,6,8,9,8
3497,Tv fanatic. Writer. Lifelong social media advocate. Certified coffee ninja. Passionate explorer.,0,5,9,6,9,5,2
3498,Organizer. Social media scholar. Bacon specialist. Amateur beer trailblazer. Hardcore tv maven.,9,0,4,0,9,0,8
3499,Pop culture buff. Reader. Food expert. Beer ninja. Tv specialist. Internet lover. Amateur writer. Twitter fanatic. Explorer. Travelaholic.,4,9,1,3,7,8,3
3500,Internet fanatic. Infuriatingly humble web lover. Unapologetic writer. Amateur gamer.,1,2,5,3,8,0,0
3501,Troublemaker. Internet nerd. Certified coffee fanatic. Hardcore zombie fanatic. Hipster-friendly organizer. Explorer.,6,6,6,3,1,0,1
3502,Professional food ninja. Music aficionado. Incurable travel guru. Friend of animals everywhere.,7,6,4,2,5,4,1
3503,Friendly coffee buff. General zombie expert. Alcohol trailblazer. Reader. Passionate beer guru. Travel advocate.,1,7,9,4,5,7,4
3504,Award-winning analyst. Hipster-friendly web guru. Lifelong internet ninja. Student. Alcohol fanatic.,2,1,4,8,3,1,2
3505,Social media lover. Amateur coffee enthusiast. Twitter guru. Passionate music fanatic. Beer buff.,2,8,8,6,8,6,2
3506,Travel nerd. Infuriatingly humble student. Pop culture guru. Freelance music scholar.,6,3,0,9,0,3,1
3507,Beer practitioner. Hipster-friendly reader. Professional food evangelist. Creator.,2,5,6,3,8,8,7
3508,Incurable coffee lover. Travel enthusiast. General communicator. Alcohol specialist. Food ninja.,8,1,4,6,6,1,1
3509,Proud pop culture maven. Incurable bacon scholar. Introvert. Lifelong analyst. Amateur student. Passionate beer evangelist.,2,0,9,2,4,9,5
3510,Tv evangelist. Explorer. Passionate social media fan. Proud thinker. Introvert. Food specialist.,0,8,9,4,3,4,9
3511,Hardcore beer specialist. Alcohol maven. Web fan. Typical coffee evangelist. Twitter enthusiast.,8,6,1,9,7,2,2
3512,General music scholar. Student. Bacon maven. Proud reader. Coffee fan.,2,2,5,7,0,5,8
3513,Subtly charming tv maven. Unapologetic communicator. Troublemaker. Travel scholar. Wannabe thinker. Music geek. Amateur explorer.,0,3,9,2,5,1,5
3514,Unapologetic pop culture geek. Web specialist. Food advocate. Devoted internet practitioner.,0,8,0,6,3,8,2
3515,Infuriatingly humble beer maven. Lifelong social media advocate. Extreme tvaholic. Communicator. Internet evangelist.,2,3,4,0,9,6,9
3516,Analyst. Subtly charming reader. Food expert. Problem solver. Professional internet junkie. Student. Music nerd.,9,0,9,1,6,6,6
3517,Extreme internet aficionado. Wannabe twitter trailblazer. Hardcore writer. Social media evangelist.,5,7,0,4,7,6,0
3518,Coffee specialist. Writer. Evil thinker. Student. Entrepreneur. Tv lover. Food guru.,2,0,8,7,0,5,9
3519,Web nerd. General bacon practitioner. Social media ninja. Award-winning coffee specialist. Food advocate.,1,5,2,5,8,7,5
3520,Subtly charming reader. Web practitioner. Hardcore student. Passionate bacon advocate. Incurable introvert.,4,5,3,7,5,7,8
3521,Hipster-friendly coffee buff. Proud entrepreneur. Bacon specialist. Social media advocate.,1,4,5,9,3,7,9
3522,Student. Food enthusiast. Passionate thinker. Unapologetic travel ninja. Hardcore alcohol specialist. Gamer.,1,9,7,8,6,1,3
3523,Lifelong zombie maven. Unapologetic social media junkie. Amateur coffee guru.,5,3,9,2,5,3,3
3524,Music fanatic. Incurable food buff. Avid beer scholar. Internet geek. Troublemaker.,6,5,8,4,2,5,3
3525,Coffee advocate. Introvert. Infuriatingly humble beer nerd. Professional food practitioner.,1,4,4,7,9,3,5
3526,Extreme introvert. Twitter buff. Evil social media evangelist. Infuriatingly humble bacon guru. Total thinker.,9,9,1,6,7,5,6
3527,Professional travel expert. Problem solver. Reader. Food maven. Troublemaker. Entrepreneur. Tv lover. Explorer.,3,0,6,3,8,4,1
3528,Student. Hipster-friendly travel fanatic. Zombie guru. Internet geek. Alcohol practitioner.,2,0,7,5,9,5,4
3529,Typical travel aficionado. Extreme alcohol evangelist. Unapologetic organizer. Zombieaholic.,9,6,6,9,5,6,8
3530,Organizer. Tvaholic. Explorer. Proud communicator. Wannabe travel geek. Troublemaker. Web guru. Typical coffee ninja.,2,3,2,0,7,6,5
3531,Extreme coffee enthusiast. Lifelong alcohol guru. Total internet evangelist. Gamer.,7,8,6,6,8,6,9
3532,Amateur social media maven. Pop cultureaholic. Troublemaker. Internet evangelist. Typical bacon ninja. Communicator. Zombie aficionado.,7,3,2,5,7,9,6
3533,Hipster-friendly bacon fanatic. Pop culture buff. Friendly food lover. Wannabe organizer.,2,9,9,5,3,6,7
3534,Zombieaholic. Communicator. Coffee lover. Wannabe explorer. Problem solver. Total twitter scholar.,4,2,7,6,8,5,9
3535,Tv buff. Falls down a lot. Professional pop culture specialist. Friendly coffee ninja. Subtly charming organizer. Passionate web scholar.,5,0,3,7,7,5,7
3536,General problem solver. Coffee specialist. Freelance organizer. Devoted explorer. Zombie junkie.,3,4,4,7,0,2,1
3537,Music scholar. Incurable alcoholaholic. Student. Evil social media fanatic. Amateur travel ninja.,5,0,9,6,7,2,4
3538,Hardcore food junkie. Beer geek. Analyst. Devoted student. Social media fan.,4,5,2,0,5,3,7
3539,Total internet expert. Unapologetic thinker. Infuriatingly humble gamer. Hardcore beer specialist. Explorer.,5,6,4,8,9,0,0
3540,Travel geek. Extreme pop culture fan. General analyst. Writer. Unapologetic problem solver.,0,2,7,1,0,1,9
3541,Typical food enthusiast. Pop culture ninja. Web nerd. Lifelong social media evangelist. Subtly charming bacon buff.,5,3,0,1,3,6,6
3542,Web advocate. Award-winning music fanatic. Introvert. Professional travel fan. Lifelong reader. Pop culture ninja. Friendly problem solver.,7,3,2,1,3,2,7
3543,Hardcore travel specialist. Web enthusiast. Total pop culture aficionado. Music maven.,3,7,7,8,8,4,0
3544,Twitter maven. Unable to type with boxing gloves on. Wannabe pop culture fanatic. Social media guru. Lifelong web buff. Communicator.,8,7,3,6,2,1,8
3545,Passionate web aficionado. General travel fanatic. Wannabe communicator. Unapologetic tv fan.,4,8,7,0,5,1,1
3546,Coffee fan. Twitter aficionado. Infuriatingly humble communicator. Avid social media advocate.,5,4,5,5,2,7,7
3547,Organizer. Typical gamer. Twitter practitioner. Troublemaker. Pop culture nerd.,5,0,9,7,5,7,7
3548,Devoted zombie buff. Food specialist. Internet enthusiast. Bacon scholar. Alcohol fanatic.,1,3,6,8,4,3,3
3549,Student. Professional travel advocate. Infuriatingly humble entrepreneur. Amateur analyst. Incurable introvert.,8,1,6,7,6,4,8
3550,Wannabe internet specialist. Infuriatingly humble music lover.,9,4,1,4,2,1,8
3551,Twitter fanatic. Amateur food fanatic. Reader. Passionate beer expert. Wannabe organizer. Creator.,8,1,2,0,7,9,6
3552,Incurable explorer. Subtly charming twitter guru. Evil tv fanatic. Beer enthusiast. Zombie maven. Amateur music ninja.,0,8,5,5,7,6,0
3553,Food enthusiast. Coffee evangelist. Amateur entrepreneur. Total music lover. Unapologetic pop culture buff. Lifelong social media geek.,4,1,5,6,1,4,8
3554,Passionate pop culture ninja. Certified travel fanatic. Introvert. Incurable web nerd. Evil bacon trailblazer. Creator.,3,0,7,3,7,7,4
3555,Total internet enthusiast. Bacon maven. Freelance alcohol trailblazer. Evil coffee evangelist.,0,1,6,8,1,7,0
3556,Music evangelist. Incurable zombie maven. Certified communicator. Alcohol geek. Passionate travel fanatic.,1,5,4,6,4,8,7
3557,Web practitioner. Subtly charming entrepreneur. Extreme organizer. Freelance creator. Alcohol guru.,5,8,8,3,4,2,8
3558,Zombie geek. Travel nerd. Tv ninja. Avid coffee evangelist. Twitter maven.,2,2,2,0,7,0,9
3559,Thinker. Alcohol practitioner. Creator. Bacon nerd. Social media guru. Extreme gamer.,0,1,7,7,4,1,4
3560,Beer lover. Evil internet expert. Friendly alcohol fan. Professional pop culture enthusiast.,4,9,0,4,0,8,3
3561,Pop culture expert. Twitter fan. Gamer. Extreme introvert. Friend of animals everywhere. Avid social media ninja. Coffeeaholic.,3,6,5,5,0,7,2
3562,Alcoholaholic. Unapologetic tv lover. Extreme analyst. Certified reader. Hipster-friendly thinker.,3,2,7,1,4,0,6
3563,Zombie evangelist. Social media buff. Avid explorer. Food advocate. Pop culture expert. Introvert.,1,3,1,0,1,8,5
3564,Bacon fan. Falls down a lot. Reader. Lifelong foodaholic. Freelance music enthusiast. Typical beer buff.,4,8,8,8,5,8,5
3565,Incurable tv practitioner. Proud student. Lifelong beer specialist. Professional travel advocate.,8,4,5,0,0,2,0
3566,Evil zombie practitioner. Reader. Infuriatingly humble tv fanatic. Hipster-friendly analyst. Award-winning music buff.,5,1,0,5,4,4,1
3567,Award-winning twitter enthusiast. Bacon ninja. Alcohol buff. Travel guru. Unapologetic organizer.,4,7,4,9,7,9,2
3568,Infuriatingly humble bacon fan. Passionate tv enthusiast. Total music trailblazer.,2,7,5,7,5,5,5
3569,Baconaholic. Avid travel junkie. Hipster-friendly alcohol buff. Amateur web specialist.,8,2,7,8,0,5,4
3570,Friend of animals everywhere. Avid social media junkie. Coffee trailblazer. Friendly web maven.,7,2,9,3,2,2,6
3571,Zombie guru. Tv nerd. Writer. Analyst. Food expert. Proud internet fanatic. Wannabe twitter enthusiast. Extreme gamer.,2,4,7,0,3,8,3
3572,Hipster-friendly zombie specialist. Organizer. Communicator. Infuriatingly humble internet maven.,9,5,9,7,0,1,9
3573,Organizer. Typical student. Bacon specialist. Creator. Subtly charming web nerd. Communicator.,7,9,9,0,1,6,2
3574,Hipster-friendly beer nerd. Gamer. Passionate music fanatic. Evil pop culture guru. Alcohol advocate.,2,7,2,6,6,8,1
