,Bios,Movies,TV,Religion,Music,Sports,Books,Politics
0,Typical twitter fanatic. Infuriatingly humble thinker. Lifelong coffee practitioner. Organizer.,5,3,4,1,3,6,7
1,Web junkie. Analyst. Infuriatingly humble introvert. Food nerd. Lifelong music fanatic. Coffee lover.,7,9,5,1,9,4,0
2,Avid web maven. Food practitioner. Gamer. Twitter fanatic. Pop culture scholar. Zombie evangelist.,1,2,6,5,6,5,4
3,Twitteraholic. Extreme web fanatic. Food buff. Infuriatingly humble entrepreneur.,5,2,7,8,2,6,6
4,Bacon enthusiast. Falls down a lot. Freelance social media fan. Infuriatingly humble introvert.,6,6,6,4,3,6,3
5,Pop culture junkie. Tv buff. Reader. Friendly travel expert. Incurable twitteraholic. Social media ninja. Coffee enthusiast. Internet specialist.,0,5,7,5,9,2,0
6,Typical thinker. Amateur explorer. Reader. Extreme student. Tv fanatic. Social media ninja.,5,4,7,5,0,8,4
7,Zombie maven. Travel geek. Professional social media buff. Avid pop culture lover.,9,8,8,2,0,0,5
8,Lifelong introvert. General travel maven. Hipster-friendly web trailblazer. Writer. Alcohol fan. Student. Communicator. Coffee guru.,8,8,2,6,1,2,9
9,Travel ninja. Amateur pop culture evangelist. Web fanatic. Freelance communicator. Zombie geek.,9,0,2,2,5,6,8
10,Tv specialist. Professional coffee scholar. Introvert. Thinker. Creator. Travel advocate.,9,2,3,4,4,9,4
11,Twitter guru. Food aficionado. Subtly charming coffee ninja. Incurable web practitioner. Travel evangelist. Hardcore music nerd. Devoted bacon maven.,0,0,2,2,3,8,9
12,Coffeeaholic. Entrepreneur. Explorer. Internet maven. Twitter evangelist. Alcohol geek.,1,6,4,4,0,1,3
13,Pop culture trailblazer. Zombie nerd. Travel specialist. Foodaholic. Total student. Twitter buff.,2,2,2,1,2,4,7
14,Travel buff. Student. Alcohol trailblazer. Passionate social media ninja. Entrepreneur. Incurable writer.,0,4,3,9,6,4,5
15,Avid pop culture fanatic. Social media enthusiast. Incurable introvert. Typical web maven. Reader.,6,9,0,3,0,6,2
16,Amateur alcohol practitioner. Food nerd. Proud analyst. Beer guru. Award-winning coffee fanatic. Organizer.,9,1,5,1,6,3,1
17,Beer practitioner. Coffee expert. Tv guru. Social media junkie. Bacon enthusiast. General student. Food nerd.,1,4,8,1,3,5,3
18,Gamer. Twitter fan. Amateur entrepreneur. Writer. Falls down a lot. Passionate music enthusiast. Freelance analyst.,2,9,3,6,6,2,9
19,Web guru. Extreme internet aficionado. Subtly charming travel maven. Food nerd. Friend of animals everywhere. Devoted pop culture fanatic.,6,5,2,4,8,8,5
20,Zombie ninja. Extreme pop culture nerd. Infuriatingly humble alcohol fanatic. Music junkie. Professional analyst.,8,6,9,6,4,3,1
21,Entrepreneur. Friendly zombie aficionado. Organizer. Passionate coffee geek. Avid introvert. Pop culture trailblazer.,6,5,8,5,7,9,8
22,Lifelong coffee expert. Friendly twitter practitioner. General internet geek. Food nerd. Pop culture fanatic. Thinker.,2,3,0,9,3,6,1
23,Lifelong internet fanatic. Hardcore problem solver. Total entrepreneur. Extreme food geek. Twitter aficionado.,0,0,8,3,5,7,4
24,Zombieaholic. Lifelong music junkie. Writer. Devoted communicator. General pop culture fan. Unapologetic gamer.,8,9,1,4,8,0,7
25,Bacon geek. Freelance food aficionado. Devoted internet fanatic. Explorer. Friendly music trailblazer. Incurable beer buff.,0,1,4,1,5,7,3
26,Devoted alcohol geek. Problem solver. General analyst. Award-winning bacon specialist. Friendly twitter aficionado.,1,9,7,5,1,9,1
27,Gamer. Certified thinker. Reader. Music maven. Total social media geek. Introvert. Typical problem solver. Award-winning explorer.,4,1,6,9,5,4,3
28,Lifelong coffee fanatic. Devoted travel enthusiast. Introvert. Troublemaker.,1,4,3,3,2,3,2
29,Amateur twitter expert. Certified travel nerd. Music buff. Proud zombie geek. Beer advocate.,4,0,9,2,5,5,8
30,Hipster-friendly coffeeaholic. Passionate travel scholar. Amateur alcohol guru. Zombie buff. Proud beer expert.,0,6,8,0,1,9,5
31,Music evangelist. Wannabe troublemaker. Alcohol junkie. Lifelong twitter geek. Typical web trailblazer. Internet practitioner.,2,2,7,5,4,6,2
32,Internet advocate. General reader. Passionate entrepreneur. Infuriatingly humble food lover.,1,4,2,1,7,0,3
33,Professional thinker. Award-winning alcohol expert. Zombie nerd. Coffee scholar. Entrepreneur. Evil tv specialist.,7,1,2,8,3,2,2
34,Zombie practitioner. Coffee buff. Total travel nerd. Music aficionado. Devoted alcohol expert.,9,7,8,7,7,7,1
35,Friendly writer. Introvert. Wannabe beer trailblazer. Zombie fanatic. Creator. Organizer.,7,5,4,6,0,3,0
36,Wannabe food trailblazer. Evil introvert. Student. Alcohol maven. Travel advocate. Troublemaker.,2,6,2,1,8,1,9
37,Friendly introvert. Troublemaker. Subtly charming alcohol specialist. Gamer. Analyst. Writer.,6,3,7,7,9,7,9
38,Unapologetic travel lover. Amateur bacon fanatic. Zombie trailblazer. Typical tv nerd. Subtly charming alcohol fanatic. Hipster-friendly food scholar.,6,7,1,4,0,3,5
39,Unapologetic introvert. Award-winning beer specialist. Creator. Lifelong food junkie.,5,3,0,9,9,4,1
40,Travel nerd. Typical problem solver. Communicator. Entrepreneur. Pop culture ninja. Proud twitteraholic. Unapologetic web aficionado.,7,1,7,0,8,1,8
41,Total internet maven. Extreme beer geek. Music fanatic. Food ninja. Amateur communicator. Typical alcohol buff. Tv junkie.,9,4,8,5,7,7,9
42,Unapologetic pop culture specialist. Social mediaholic. Incurable web fanatic. Tv trailblazer. Zombie nerd. Twitter fan.,1,6,6,2,0,1,2
43,Explorer. Wannabe introvert. Pop culture enthusiast. Hardcore foodaholic. Student. Hipster-friendly gamer.,7,9,6,5,0,3,2
44,Lifelong zombie advocate. Certified pop cultureaholic. Communicator. Typical web guru. Coffee nerd.,0,9,0,2,2,2,8
45,Extreme reader. Bacon guru. Travel practitioner. Twitter maven. Thinker. Pop culture expert.,4,4,2,0,8,4,6
46,Explorer. Social media buff. Evil bacon nerd. Friendly zombie evangelist. Typical travel advocate.,4,9,7,6,0,6,2
47,Passionate bacon practitioner. Twitter nerd. Unable to type with boxing gloves on. Travel fanatic. Internet aficionado. Devoted coffee buff. Music lover.,5,7,0,4,8,0,9
48,Award-winning twitter buff. Subtly charming bacon maven. Friend of animals everywhere. Zombie geek.,1,3,3,8,4,4,4
49,Passionate thinker. Web buff. Devoted travel specialist. Evil food ninja. Freelance explorer. Reader. Amateur problem solver.,3,1,7,3,4,5,3
50,Zombie guru. Alcohol ninja. Student. Gamer. Evil travel fanatic. Twitter lover. Communicator. Troublemaker.,5,2,3,7,6,1,9
51,Subtly charming internet guru. Lifelong web nerd. Infuriatingly humble writer.,1,7,7,9,5,7,3
52,Problem solver. Internet evangelist. Devoted social media fanatic. Passionate twitter geek.,3,6,8,9,3,1,3
53,Troublemaker. Proud web guru. General communicator. Coffee expert.,7,4,3,9,0,1,5
54,Web maven. Beeraholic. Freelance music trailblazer. Tv fanatic. Lifelong internet geek.,5,2,8,8,8,8,1
55,Organizer. Hardcore web guru. Certified coffee ninja. Amateur explorer. Tv maven. Wannabe twitter practitioner. Food expert. Gamer.,6,9,3,9,0,1,9
56,Pop culture ninja. Avid reader. Food scholar. Internet fanatic. Analyst. Proud problem solver.,4,7,0,4,4,6,8
57,Proud tv scholar. Introvert. Organizer. Unapologetic web expert. Friendly beer geek.,4,2,5,6,7,4,7
58,Wannabe tv geek. Writer. Food maven. Entrepreneur. Introvert. Bacon evangelist. Internet scholar.,6,1,5,5,3,1,6
59,Social media guru. Pop culture trailblazer. Hardcore communicator. Entrepreneur.,1,3,0,0,9,3,3
60,Coffee fanatic. Analyst. Zombie fan. Pop culture expert. Internet lover. Web scholar. Writer. Freelance travel fanatic. Award-winning alcohol aficionado.,6,2,9,7,1,6,7
61,Gamer. Hipster-friendly music enthusiast. Tv fanatic. Total communicator. Unapologetic travel maven.,3,1,2,9,1,4,5
62,Professional twitter junkie. Travel advocate. Hardcore food aficionado. Explorer. Friendly coffee trailblazer. Reader.,6,4,9,2,1,2,9
63,Twitter specialist. Subtly charming alcohol evangelist. Freelance coffee scholar.,4,1,5,5,0,0,7
64,Friend of animals everywhere. Zombie lover. Bacon scholar. Evil food aficionado. Passionate problem solver.,6,6,1,3,1,0,0
65,Infuriatingly humble bacon guru. Incurable explorer. Food lover. Extreme travel evangelist.,8,9,4,3,5,8,4
66,Professional music scholar. Writer. Coffee lover. Twitter trailblazer. Incurable tv advocate. Bacon buff. Alcohol maven.,9,7,3,6,9,3,5
67,Infuriatingly humble music trailblazer. Hardcore food evangelist. Communicator. Total zombieaholic.,8,6,4,3,7,6,2
68,Prone to fits of apathy. Internet expert. Proud reader. Certified analyst. Friendly problem solver.,9,8,7,5,3,1,2
69,Music trailblazer. Introvert. Award-winning beer geek. Problem solver.,2,8,3,0,7,1,9
70,Beer trailblazer. Reader. Travel geek. Total student. Musicaholic. Freelance organizer. Food lover.,0,9,6,3,0,7,6
71,Bacon geek. Incurable beer expert. Organizer. Hipster-friendly pop culture evangelist. Hardcore tv fan. Devoted twitter lover.,2,2,3,7,4,0,3
72,Proud reader. Lifelong internet fan. Freelance food nerd. Web maven. General music junkie. Subtly charming thinker.,9,3,7,2,4,2,1
73,Problem solver. Web evangelist. Communicator. Alcohol lover. Total tv geek. Twitter expert. Future teen idol. Subtly charming travel buff.,5,7,2,8,3,0,1
74,Hardcore beer practitioner. Typical bacon evangelist. Certified social media buff.,3,7,8,2,1,0,7
75,Lifelong tv buff. Communicator. Hipster-friendly travel nerd. Problem solver. General creator.,0,0,9,2,7,7,1
76,Wannabe twitter aficionado. Pop culture nerd. Coffee maven. Devoted bacon scholar. Entrepreneur.,7,2,7,5,5,7,0
77,Total web expert. Incurable coffee aficionado. Music fanatic. Alcohol trailblazer. Avid introvert. Subtly charming twitter fan.,3,4,2,7,5,9,8
78,Incurable foodaholic. Freelance internet lover. Problem solver. Travel junkie. Avid bacon evangelist. Amateur pop culture nerd.,4,3,6,0,8,4,9
79,Lifelong communicator. Devoted coffeeaholic. Introvert. Typical reader.,5,8,6,3,5,0,7
80,Total zombie enthusiast. Devoted beer ninja. Tv fanatic. Lifelong web evangelist.,3,3,0,4,3,9,5
81,Award-winning pop culture lover. Internet advocate. Twitter fanatic. Analyst. Zombie practitioner.,3,1,8,9,0,8,4
82,Certified travel junkie. Gamer. Reader. Food maven. Extreme alcohol aficionado. Typical tv specialist.,1,6,3,0,0,0,0
83,Extreme travel practitioner. Gamer. Typical music buff. Food trailblazer. Beer lover. Bacon junkie.,9,3,5,8,9,1,5
84,Pop culture guru. Zombie maven. Twitteraholic. Coffee trailblazer. Problem solver.,4,1,7,1,5,5,4
85,Freelance social media nerd. Internet ninja. Introvert. Beer evangelist. Alcohol enthusiast. Bacon geek. Troublemaker.,2,8,2,5,4,9,1
86,Tv aficionado. Lifelong communicator. Travel ninja. Hardcore web buff. Typical music geek.,0,4,6,0,2,4,9
87,Devoted web maven. Friend of animals everywhere. Analyst. Freelance music buff. Bacon junkie.,0,9,5,2,7,2,0
88,Typical bacon aficionado. Internet guru. Food lover. Music enthusiast. Twitter geek. Social media ninja.,8,0,8,1,4,3,5
89,Introvert. Freelance music expert. Devoted social media advocate. Evil reader. Zombie fanatic. Professional analyst.,4,6,6,3,4,0,6
90,General reader. Incurable introvert. Internet junkie. Travelaholic. Food enthusiast. Web maven. Thinker. Tv nerd.,2,5,8,2,3,1,6
91,Problem solver. Troublemaker. Extreme reader. Bacon fanatic. Communicator. Award-winning gamer.,1,3,0,9,7,5,8
92,Entrepreneur. Communicator. Devoted baconaholic. Hipster-friendly internet specialist. Creator.,2,2,1,3,7,5,2
93,Twitter trailblazer. Internet maven. Incurable beeraholic. General pop culture specialist.,2,1,9,7,8,7,8
94,Music buff. Twitter evangelist. Unapologetic travel fanatic. Beer fan. Extreme food expert. Tv nerd. Pop culture lover.,5,2,5,5,3,9,6
95,Friendly beer maven. Coffee junkie. Award-winning bacon practitioner. Pop culture enthusiast.,8,1,9,0,5,2,2
96,Passionate music fanatic. Falls down a lot. Travel advocate. Pop culture lover. Twitter practitioner.,0,7,8,6,0,5,0
97,Thinker. Lifelong travelaholic. Alcohol enthusiast. Incurable social media lover. Communicator.,5,8,2,8,0,9,8
98,Freelance thinker. Amateur music trailblazer. Travel practitioner. Coffee junkie. Pop culture scholar. Evil webaholic.,9,7,2,3,1,1,6
99,Proud problem solver. Incurable entrepreneur. Travelaholic. Writer. Professional web evangelist. Passionate pop culture lover.,4,2,2,7,8,2,4
100,Explorer. Typical travel nerd. Unable to type with boxing gloves on. Bacon ninja. Music fan. Professional reader.,8,9,5,1,8,4,9
101,Coffee evangelist. Internet buff. Bacon nerd. Passionate student. Beer maven. Professional alcohol guru. Tv ninja.,0,2,9,6,7,2,4
102,Food ninja. Twitter guru. Music practitioner. General gamer. Thinker. Travel junkie.,0,8,2,6,0,1,7
103,Entrepreneur. Typical travel advocate. General music trailblazer. Alcohol maven. Gamer.,5,4,2,8,4,7,6
104,Bacon aficionado. Hardcore twitter enthusiast. Hipster-friendly pop culture expert. Student. Certified beer buff.,7,0,0,7,8,8,8
105,Unapologetic coffee ninja. Lifelong web fanatic. Internet practitioner. Travel enthusiast. Devoted bacon fan. Zombie expert.,1,0,7,0,6,8,7
106,Music evangelist. General coffee fan. Bacon specialist. Hardcore zombie ninja. Gamer. Thinker.,4,1,7,8,8,1,4
107,Web geek. Avid music enthusiast. Beer fan. Thinker. Entrepreneur. Unable to type with boxing gloves on.,7,1,8,6,1,9,3
108,Hardcore entrepreneur. Freelance web junkie. Total introvert. Devoted travel geek. Unable to type with boxing gloves on. Reader.,6,9,4,0,9,6,2
109,Bacon fan. Music aficionado. Twitter specialist. Certified coffeeaholic. Explorer.,9,7,2,8,8,2,5
110,Internet fanatic. Extreme social media lover. Professional student. Web trailblazer. Certified troublemaker. Entrepreneur. Award-winning thinker. Travel maven.,4,2,8,8,3,5,2
111,Social media fanatic. Zombie buff. Food geek. Lifelong entrepreneur. Evil bacon maven. Travel fan. Writer. Communicator. Friendly coffee enthusiast.,7,8,4,1,5,9,5
112,Lifelong bacon nerd. Passionate pop culture fanatic. Friendly beer ninja. Tv enthusiast. Writer. Evil food guru. Extreme music maven. Alcohol trailblazer.,1,9,2,9,6,8,0
113,Social media junkie. Hipster-friendly internet specialist. Avid food enthusiast. Bacon advocate. Musicaholic. Alcohol fan. Zombie nerd.,7,9,3,3,3,0,6
114,Beer nerd. Friendly web specialist. Devoted pop culture geek. Extreme social media ninja.,5,7,8,9,0,3,1
115,Writer. Communicator. Award-winning food junkie. Internet ninja. Incurable bacon fanatic.,2,6,7,7,3,0,3
116,Entrepreneur. Amateur gamer. Zombie advocate. Infuriatingly humble communicator. Proud reader.,1,4,6,6,7,9,4
117,Pop culture buff. Typical writer. Infuriatingly humble music geek. Web advocate.,0,9,2,0,4,5,2
118,Coffee geek. Bacon evangelist. Travel maven. Writer. Devoted food practitioner. Incurable beer fanatic. Troublemaker.,6,6,6,5,8,7,9
119,Social media buff. Professional travel aficionado. Friendly analyst. Alcohol fanatic.,7,6,3,5,9,0,2
120,Zombie fanatic. Problem solver. Certified thinker. Alcohol lover. Social media junkie. Pop culture maven. Twitter advocate.,2,1,4,7,7,7,3
121,Coffee junkie. Certified zombie geek. Writer. Web fanatic. Subtly charming beeraholic. Travel enthusiast. Music evangelist.,0,1,9,1,9,3,2
122,Internet enthusiast. Bacon fan. Hipster-friendly music maven. Certified social media nerd. Alcohol evangelist. Future teen idol.,7,6,2,3,8,3,2
123,Music aficionado. Devoted pop culture junkie. Amateur social media nerd. Travel trailblazer.,2,6,4,7,0,6,3
124,Wannabe beer expert. Alcohol ninja. Twitter specialist. Certified coffee practitioner. Gamer.,9,8,3,7,9,7,7
125,Wannabe entrepreneur. Proud music trailblazer. Falls down a lot. Tv junkie. Alcohol expert. Avid internet evangelist.,6,3,1,9,1,6,7
126,Incurable beer aficionado. Social media ninja. Food fanatic. Tv practitioner. Total web junkie. Hipster-friendly music lover.,5,3,5,9,7,0,0
127,Incurable twitter evangelist. Avid music lover. Passionate travel nerd. Lifelong internet geek. Evil food scholar. Proud bacon ninja.,9,7,8,9,2,6,6
128,Devoted reader. Unable to type with boxing gloves on. Hardcore music enthusiast. Evil explorer.,3,2,0,1,8,1,8
129,Incurable social media fanatic. Analyst. Introvert. Gamer. Unapologetic writer. General tv expert. Zombie lover. Total food evangelist.,4,1,4,5,4,8,3
130,Unable to type with boxing gloves on. Communicator. Passionate music advocate. Reader. Beer nerd.,7,4,6,5,0,6,1
131,Proud food evangelist. Alcohol geek. Troublemaker. Explorer. Coffee guru. Music fanatic. Extreme tv aficionado.,5,6,4,4,8,7,3
132,Certified analyst. Pop culture practitioner. Alcohol evangelist. Gamer. Beer specialist.,0,3,8,3,3,8,8
133,Avid beer fan. Zombie ninja. Web enthusiast. Wannabe student. Twitter practitioner.,9,5,0,0,3,1,8
134,Travel fanatic. Alcohol lover. Infuriatingly humble internet geek. Friendly pop culture expert.,9,8,9,8,0,7,1
135,Unapologetic beer scholar. Certified gamer. Tv evangelist. Lifelong student. Freelance twitter geek.,0,2,8,7,1,8,2
136,Prone to fits of apathy. Passionate twitter enthusiast. Explorer. Subtly charming reader. Gamer.,8,2,8,5,8,2,7
137,Bacon fan. Evil music expert. Pop culture junkie. Total twitter practitioner.,2,5,1,8,8,3,3
138,Student. Beeraholic. Avid bacon nerd. Alcohol fanatic. Award-winning gamer. Extreme coffee specialist. Zombie enthusiast.,6,6,9,2,0,6,1
139,Music scholar. Alcohol trailblazer. Prone to fits of apathy. Baconaholic. Explorer.,1,7,5,6,7,6,5
140,Twitter practitioner. Internet scholar. Extreme web fan. Beer aficionado. Coffee nerd. Food evangelist. Explorer. Pop culture trailblazer.,7,9,4,3,6,3,5
141,Coffee practitioner. Internet aficionado. Total web fanatic. Travelaholic. Bacon scholar.,8,4,0,5,6,8,1
142,Lifelong internet buff. Web aficionado. Avid travel maven. Tv nerd.,0,5,1,3,5,1,6
143,Travel practitioner. Hipster-friendly twitter fanatic. Hardcore thinker. Gamer. Coffee advocate.,4,6,9,6,2,1,1
144,Web specialist. Lifelong zombie maven. Coffee ninja. Hipster-friendly analyst.,9,2,0,7,4,9,8
145,Evil beeraholic. Tv ninja. Incurable music maven. Devoted pop culture scholar. Zombie junkie. Writer.,2,4,5,9,5,3,5
146,Friend of animals everywhere. Hipster-friendly twitter guru. Subtly charming analyst.,0,0,0,6,1,9,6
147,Food aficionado. Award-winning entrepreneur. Tv advocate. Freelance web enthusiast.,0,9,3,5,1,9,5
148,Wannabe pop culture buff. Music enthusiast. Award-winning creator. Twitter evangelist.,9,7,3,3,3,3,8
149,Tv lover. Future teen idol. Travel nerd. Musicaholic. Professional organizer. Internet fanatic.,0,9,3,1,0,5,2
150,Social media nerd. Beer guru. Pop culture maven. Internet junkie. Tv scholar.,6,0,1,4,1,6,9
151,Twitter guru. Web fan. General entrepreneur. Professional thinker. Freelance creator. Food fanatic. Certified student.,6,5,5,4,4,3,2
152,Bacon nerd. Typical communicator. Freelance alcohol ninja. Social media practitioner. Total internet geek. Proud pop culture guru.,2,6,0,2,2,1,9
153,Tv advocate. Award-winning beer aficionado. Friend of animals everywhere. Alcohol junkie.,2,2,6,0,7,2,2
154,Bacon specialist. Music fanatic. Amateur tv trailblazer. Travel guru. Professional troublemaker.,6,0,8,0,6,8,7
155,Wannabe web scholar. Professional beeraholic. Certified gamer. Avid entrepreneur. Extreme creator. Proud tv specialist.,5,9,0,9,4,3,0
156,Extreme web maven. Twitter trailblazer. Passionate social media fanatic. Beer advocate.,3,5,2,2,1,0,7
157,Zombie trailblazer. Lifelong tv evangelist. Friendly musicaholic.,1,2,5,9,8,8,7
158,Pop culture expert. Communicator. Zombie scholar. Food evangelist. Beer aficionado. Writer. Total explorer. Avid tv enthusiast.,1,5,6,1,8,7,2
159,Entrepreneur. Amateur troublemaker. Pop culture guru. Creator. Extreme beeraholic.,4,8,7,0,0,7,3
160,Zombie ninja. Internet fan. Extreme twitter aficionado. Wannabe beer scholar.,3,2,3,4,9,1,6
161,Typical troublemaker. Organizer. Certified alcohol aficionado. Writer. Thinker. Travel trailblazer.,9,3,7,2,4,0,1
162,Passionate troublemaker. Reader. Evil alcohol junkie. Zombie ninja. Gamer. Beer guru. Subtly charming web evangelist.,6,3,3,9,8,5,3
163,Coffee fanatic. Incurable explorer. Future teen idol. Troublemaker. Tv evangelist. Proud beer maven.,6,9,0,2,3,5,1
164,Lifelong music geek. Hardcore beer fanatic. Food fan. Twitter junkie. General organizer.,5,1,7,6,9,4,6
165,Bacon nerd. Devoted social media fanatic. Problem solver. Travel practitioner. Coffee junkie.,4,9,3,4,6,3,7
166,Organizer. Hipster-friendly twitter evangelist. Social media junkie. Pop culture expert. Introvert. Coffee buff.,7,3,9,8,5,7,4
167,Professional bacon guru. Web enthusiast. Lifelong food fanatic. Pop culture evangelist. Travel practitioner.,4,3,7,8,8,3,4
168,Proud coffee nerd. Freelance internet evangelist. Typical twitter specialist. Explorer.,3,1,6,8,9,4,8
169,Food nerd. Coffee buff. Tv aficionado. Amateur explorer. Web fanatic. Social media enthusiast.,8,8,5,5,3,1,9
170,Analyst. Extreme problem solver. Infuriatingly humble pop culture nerd. Gamer.,7,9,4,7,4,5,8
171,Evil zombie enthusiast. Troublemaker. Professional social media scholar. Internet aficionado.,6,4,8,0,8,1,5
172,Avid bacon trailblazer. Freelance problem solver. Typical thinker. Travel scholar. Professional zombie buff. Lifelong web junkie.,8,4,0,9,2,5,5
173,Hipster-friendly pop culture enthusiast. Writer. Travel ninja. Gamer. Music scholar.,0,3,6,4,5,5,4
174,Student. Coffee fanatic. Unapologetic travel aficionado. Twitteraholic. Incurable bacon ninja.,4,3,3,0,0,1,5
175,Freelance travel buff. Twitter advocate. Certified thinker. Creator. Food fanatic. Alcohol geek.,9,4,3,1,3,5,7
176,Internetaholic. Tv enthusiast. Amateur travel fanatic. Proud organizer. Problem solver. Food lover. Twitter practitioner. Zombie geek.,6,3,8,0,2,0,9
177,Writer. Bacon trailblazer. General student. Avid entrepreneur. Award-winning problem solver.,7,8,4,6,6,8,1
178,General organizer. Award-winning baconaholic. Freelance alcohol aficionado. Avid communicator.,5,1,3,6,2,8,2
179,Hipster-friendly travel practitioner. Professional analyst. Proud webaholic. Alcohol fan. Friendly organizer.,2,5,2,8,9,0,6
180,Unapologetic web geek. Zombie maven. Hardcore beer specialist. Reader. Pop culture evangelist. Bacon fanatic. Typical troublemaker.,3,8,2,2,1,0,2
181,Devoted organizer. General music aficionado. Social media enthusiast. Food nerd. Freelance beer maven.,1,5,7,8,5,7,0
182,Internet aficionado. Hipster-friendly music fan. Extreme student. Alcohol evangelist. Bacon junkie.,9,2,0,7,4,2,1
183,Hipster-friendly alcoholaholic. Music specialist. Certified pop culture ninja. Total thinker.,5,5,5,1,8,3,3
184,Troublemaker. Creator. Beer enthusiast. Bacon ninja. Zombie practitioner. Twitter aficionado.,4,9,8,2,9,7,3
185,Social media buff. Evil introvert. Tv practitioner. Incurable twitter nerd. Typical food fanatic. Music fanatic.,5,5,0,0,7,5,9
186,Hipster-friendly entrepreneur. Passionate travel maven. Freelance social media fanatic. Bacon evangelist. Reader. Proud web fanatic.,9,5,7,4,7,5,7
187,Freelance internet advocate. General analyst. Problem solver.,4,9,4,1,1,5,6
188,Infuriatingly humble analyst. Certified student. Hipster-friendly internet practitioner.,4,0,7,8,3,3,9
189,Professional web guru. Analyst. Amateur tv lover. Total thinker. Infuriatingly humble alcohol expert. Music aficionado.,3,6,7,4,6,6,2
190,Professional coffee practitioner. General entrepreneur. Hardcore web junkie.,2,3,0,3,8,2,1
191,Social media fanatic. Hardcore web aficionado. Evil internet advocate. Incurable entrepreneur.,2,6,5,6,9,6,0
192,Alcohol buff. Professional social media junkie. Avid zombie lover. Internet expert. Analyst. Friendly travel enthusiast.,9,3,2,1,6,4,8
193,Typical explorer. Web advocate. Twitter scholar. Alcohol expert. Reader. Entrepreneur. Beeraholic.,7,8,1,8,2,6,5
194,Organizer. Zombie geek. Twitter guru. Food expert. Amateur music fanatic. Introvert. Reader. Friendly travel junkie.,2,1,8,8,1,2,0
195,Amateur zombie buff. Explorer. Avid writer. Passionate social media geek.,9,5,8,7,4,5,1
196,Beer enthusiast. Evil internet fan. Award-winning zombie practitioner.,0,0,9,0,8,5,2
197,Internet trailblazer. Travel buff. Freelance social mediaholic. Award-winning music evangelist.,1,4,3,8,1,0,3
198,Twitter fanatic. Devoted alcohol guru. Travel lover. Beer evangelist. Passionate social media fan. Avid analyst.,9,2,7,0,1,6,7
199,Creator. Amateur travel fan. Food buff. Hardcore social media practitioner. Typical pop culture specialist.,5,5,5,4,6,7,3
200,Pop culture nerd. Wannabe food enthusiast. Social media fanatic. Hardcore bacon expert.,0,4,7,3,8,9,2
201,Incurable music evangelist. Friendly pop culture advocate. Proud travel ninja.,1,9,4,8,4,2,3
202,Music aficionado. Proud travel expert. Bacon evangelist. Evil food guru. Infuriatingly humble twitter maven.,6,8,8,0,3,6,4
203,Travel nerd. Zombie fan. Web evangelist. Social media scholar. Internet fanatic.,5,4,2,2,7,7,4
204,Analyst. Beer geek. Infuriatingly humble zombie nerd. Entrepreneur. Passionate tv guru. Organizer. Freelance gamer. Pop culture enthusiast.,5,9,6,1,8,2,0
205,Subtly charming organizer. Friend of animals everywhere. Devoted food enthusiast.,8,4,8,5,0,3,2
206,Web fanatic. Subtly charming reader. Incurable zombie buff. Award-winning bacon fan. Thinker.,8,6,8,7,3,4,3
207,Extreme tv ninja. Hardcore organizer. Unapologetic web trailblazer. Travel junkie. General explorer. Typical bacon scholar. Troublemaker.,3,6,7,2,8,9,9
208,Tv specialist. Extreme student. Beer nerd. Unapologetic organizer. General music lover. Passionate bacon trailblazer.,0,6,6,3,0,3,5
209,Hardcore student. Incurable food nerd. Problem solver. Evil social media lover. Bacon maven.,6,4,7,3,0,5,3
210,Troublemaker. Thinker. Student. Award-winning internet fanatic. Social media practitioner.,4,1,7,3,4,5,4
211,Evil internet specialist. Friend of animals everywhere. Wannabe web evangelist. Hardcore problem solver.,4,2,4,2,9,6,1
212,Tv fanatic. Writer. Lifelong social media advocate. Certified coffee ninja. Passionate explorer.,3,6,6,1,3,7,3
